www.pewresearch.org, www.thefreedictionary.com, www.thefreedictionary.com, up.thefreedictionary.com, www.thefreedictionary.com, www.thefreedictionary.com, secure.thefreedictionary.com, secure.thefreedictionary.com, secure.thefreedictionary.com, secure.thefreedictionary.com, secure.thefreedictionary.com, up.thefreedictionary.com, www.thefreedictionary.com, www.freethesaurus.com, legal-dictionary.thefreedictionary.com, acronyms.thefreedictionary.com, encyclopedia.thefreedictionary.com, up.thefreedictionary.com, up.thefreedictionary.com, www.thefreedictionary.com, word-of-the-day.thefreedictionary.com, www.thefreedictionary.com, www.thefreedictionary.com, www.thefreedictionary.com, www.thefreedictionary.com, www.thefreedictionary.com, www.freethesaurus.com, legal-dictionary.thefreedictionary.com, acronyms.thefreedictionary.com, encyclopedia.thefreedictionary.com, www.thefreedictionary.com, www.thefreedictionary.com, secure.thefreedictionary.com, secure.thefreedictionary.com, secure.thefreedictionary.com, secure.thefreedictionary.com, secure.thefreedictionary.com, www.thefreedictionary.com, www.thefreedictionary.com, secure.thefreedictionary.com, www.thefreedictionary.com, www.thefreedictionary.com, www.thefreelibrary.com, www.thefreelibrary.com, www.thefreelibrary.com, www.thefreelibrary.com, www.thefreelibrary.com, www.thefreelibrary.com, www.thefreelibrary.com, www.thefreelibrary.com, www.thefreelibrary.com, www.thefreelibrary.com, www.thefreelibrary.com, www.thefreelibrary.com, www.thefreedictionary.com, www.thefreedictionary.com, www.freethesaurus.com, www.thefreedictionary.com, acronyms.thefreedictionary.com, acronyms.thefreedictionary.com, legal-dictionary.thefreedictionary.com, www.freethesaurus.com, www.thefreedictionary.com, legal-dictionary.thefreedictionary.com, www.freethesaurus.com, www.thefreedictionary.com, acronyms.thefreedictionary.com, acronyms.thefreedictionary.com, www.freethesaurus.com, www.thefreedictionary.com, acronyms.thefreedictionary.com, acronyms.thefreedictionary.com, acronyms.thefreedictionary.com, www.freethesaurus.com, www.thefreedictionary.com, acronyms.thefreedictionary.com, acronyms.thefreedictionary.com, legal-dictionary.thefreedictionary.com, medical-dictionary.thefreedictionary.com, www.freethesaurus.com, www.thefreedictionary.com, acronyms.thefreedictionary.com, acronyms.thefreedictionary.com, acronyms.thefreedictionary.com, www.thefreedictionary.com, www.thefreedictionary.com, www.thefreedictionary.com, www.thefreedictionary.com, legal-dictionary.thefreedictionary.com, www.thefreedictionary.com, www.thefreedictionary.com, www.thefreedictionary.com, www.thefreedictionary.com, www.thefreedictionary.com, www.thefreedictionary.com, acronyms.thefreedictionary.com, www.thefreedictionary.com, legal-dictionary.thefreedictionary.com, www.thefreedictionary.com, www.facebook.com, twitter.com, www.thefreedictionary.com, word-of-the-day.thefreedictionary.com, up.thefreedictionary.com, up.thefreedictionary.com, up.thefreedictionary.com, up.thefreedictionary.com, up.thefreedictionary.com, www.thefreedictionary.com, word-of-the-day.thefreedictionary.com, www.thefreedictionary.com, www.thefreedictionary.com, www.thefreedictionary.com, www.thefreedictionary.com, www.thefreedictionary.com, www.thefreedictionary.com, www.thefreedictionary.com, www.thefreedictionary.com, www.farlex.com
encyclopedia2.thefreedictionary.com, nxslink.fox59.com, www.newsnationnow.com, www.fox59.com, products.bestreviews.com, www.fox59beourguest.com, jobs.fox59.com, jobs.fox59.com, jobs.fox59.com, nxslink.fox59.com, www.facebook.com, twitter.com, www.linkedin.com, bestreviews.com, bestreviews.com, jobs.fox59.com, publicfiles.fcc.gov, www.nexstar.tv, apps.apple.com, play.google.com, apps.apple.com, play.google.com, www.facebook.com, twitter.com, www.instagram.com, www.youtube.com, www.haystack.tv, www.nexstar.tv, www.nexstar.tv, www.nexstar.tv, www.covers.com, www.thehill.com, www.newsnationnow.com, www.bestreviews.com, www.newsnationnow.com, www.nexstardigital.com, www.nexstar.tv
fox59.com, help.npr.org, shopnpr.org, shopnpr.org, media.npr.org, media.npr.org, media.npr.org, media.defense.gov, www.militarytimes.com, media.npr.org, media.npr.org, flyingtigersavg.com, media.npr.org, media.npr.org, www.moody.af.mil, www.af.mil, media.npr.org, time.com, www.youtube.com, www.chinadaily.com.cn, www.af.mil, media.npr.org, www.facebook.com, www.instagram.com, help.npr.org, shopnpr.org, www.nprpresents.org, text.npr.org
www.npr.org, live5results.com, www.palmettolifesc.com, burst.com, www.scemd.org, www.investigatetv.com, www.lowcountryweekend.com, www.511sc.org, www.palmettolifesc.com, gray.tv, live5results.com, www.vuit.com, www.investigatetv.com, www.telemundocharleston.com, www.circleallaccess.com, www.graydc.com, www.facebook.com, www.twitter.com, publicfiles.fcc.gov, publicfiles.fcc.gov, webpubcontent.gray.tv, gray.tv, live5results.com, gray.tv
www.live5news.com
www.registercitizen.com, checkout.ocregister.com, www.accuweather.com, enewspaper.ocregister.com, comicskingdom.com, store.ocregister.com, obits.ocregister.com, obits.ocregister.com, www.scngobits.com, checkout.ocregister.com, myaccount.ocregister.com, checkout.ocregister.com, myaccount.ocregister.com, checkout.ocregister.com, www.accuweather.com, enewspaper.ocregister.com, comicskingdom.com, www.bostonherald.com, www.nydailynews.com, www.dailynews.com, www.orlandosentinel.com, checkout.ocregister.com, myaccount.ocregister.com, enewspaper.ocregister.com, myaccount.ocregister.com, marketplace.socaladsonline.com, marketplace.socaladsonline.com, www.scngobits.com, scngorangecounty.column.us, careers.socalnewsgroup.com, www.socalnewsgroup.com, www.medianewsgroup.com, myworkdaycenter.wd5.myworkdayjobs.com, www.medianewsgroup.com, www.medianewsgroup.com, socalnewsgroup.com, socalnewsgroup.com, store.ocregister.com, myaccount.ocregister.com, access.medianewsgroup.com, www.socalnewsgroup.com, www.socalnie.com, sponsor.medianewsgroup.com, checkout.ocregister.com, www.medianewsgroup.com, www.medianewsgroup.com, www.medianewsgroup.com, www.medianewsgroup.com, my.datasubject.com, www.medianewsgroup.com, vip.wordpress.com, www.socalnewsgroup.com, www.digitalfirstmedia.com
www.ocregister.com, twitter.com, www.linkedin.com, facebook.com, twitter.com, instagram.com, youtube.com
www.binghamton.edu, www.instagram.com, www.facebook.com, twitter.com, www.youtube.com, www.instagram.com, www.facebook.com, twitter.com, www.youtube.com, www.trumanlibrary.gov, my.community.com, www.facebook.com, twitter.com, www.instagram.com, www.facebook.com, twitter.com, www.youtube.com
www.whitehouse.gov, www.asu.edu, asuevents.asu.edu, newsroom.asu.edu, www.facebook.com, www.instagram.com, twitter.com, lib.asu.edu, asuonline.asu.edu, asuonline.asu.edu, worldwarshe.substack.com, www.instagram.com, en.wikipedia.org, scetl.asu.edu, search.asu.edu, catalog.apps.asu.edu, specialevents.asu.edu, obamawhitehouse.archives.gov, twitter.com, www.youtube.com, www.instagram.com, newsroom.asu.edu, students.asu.edu, students.asu.edu, president.asu.edu, about.asu.edu, www.asu.edu, cfo.asu.edu, asuevents.asu.edu, asunow.asu.edu, www.asu.edu, www.asu.edu, isearch.asu.edu, www.asu.edu, my.asu.edu, www.asu.edu, www.asu.edu, www.asu.edu, www.asu.edu, www.asu.edu, www.asu.edu
news.asu.edu, nxslink.rochesterfirst.com, products.bestreviews.com, jobs.rochesterfirst.com, jobs.rochesterfirst.com, jobs.rochesterfirst.com, nxslink.rochesterfirst.com, www.cbs.com, www.facebook.com, twitter.com, www.linkedin.com, bestreviews.com, bestreviews.com, publicfiles.fcc.gov, itunes.apple.com, play.google.com, www.facebook.com, twitter.com, www.instagram.com, www.youtube.com, www.haystack.tv, www.nexstar.tv, www.nexstar.tv, www.nexstar.tv, www.covers.com, www.nexstar.tv, www.thehill.com, www.newsnationnow.com, www.bestreviews.com, www.newsnationnow.com, www.nexstardigital.com, www.nexstar.tv
www.rochesterfirst.com
www.sciencedaily.com, webbook.nist.gov, nvd.nist.gov, csrc.nist.gov, nistdigitalarchives.contentdm.oclc.org, www.facebook.com, www.linkedin.com, twitter.com, historynewsnetwork.org, www.facebook.com, www.linkedin.com, www.twitter.com, www.youtube.com, www.instagram.com, public.govdelivery.com, www.commerce.gov, www.commerce.gov, www.science.gov, www.usa.gov, vote.gov
www.nist.gov, classifieds.daytondailynews.com, dailylawjournal.org, classifieds.daytondailynews.com, www.dayton.com, classifieds.daytondailynews.com, daytondailynews.upickem.net, www.dayton.com, games.daytondailynews.com, classifieds.daytondailynews.com, classifieds.daytondailynews.com, www.newspapers.com, myaccount.daytondailynews.com, www.nieonline.com, myaccount.daytondailynews.com, www.newspapers.com, myaccount.daytondailynews.com, jobs.coxenterprises.com, classifieds.daytondailynews.com, coxfirstmedia.com, classifieds.daytondailynews.com, www.facebook.com, twitter.com, jobs.coxenterprises.com, www.facebook.com, twitter.com, urldefense.com, jobs.coxenterprises.com, www.nieonline.com, myaccount.daytondailynews.com, www.newspapers.com, myaccount.daytondailynews.com, jobs.coxenterprises.com, classifieds.daytondailynews.com, coxfirstmedia.com, classifieds.daytondailynews.com, subscribe.daytondailynews.com, hub.daytondailynews.com, hub.daytondailynews.com, jobs.coxenterprises.com
www.daytondailynews.com, cms.dvidshub.net, cms.dvidshub.net, prhome.defense.gov, www.acq.osd.mil, open.defense.gov, dcmo.defense.gov, open.defense.gov, www.usa.gov, www.dodig.mil, dodcio.defense.gov, www.dodig.mil, www.sapr.mil, www.dimoc.mil, www.dimoc.mil, www.govinfo.gov, www.facebook.com, www.twitter.com, www.defense.gov
www.dvidshub.net, send, www.facebook.com, twitter.com, www.linkedin.com, plus.elpais.com, plus.elpais.com, www.emagister.com.mx, www.emagister.com, www.emagister.com, www.emagister.com, www.emagister.com, www.emagister.com, www.emagister.com, www.emagister.com, www.emagister.com, www.emagister.com, www.emagister.com, www.emagister.com, www.emagister.com, www.emagister.com.mx, www.emagister.com, www.emagister.com, www.emagister.com, www.emagister.com, www.emagister.com, www.emagister.com, www.emagister.com, www.emagister.com, www.emagister.com, www.emagister.com, www.emagister.com, www.emagister.com, idiomas.elpais.com, idiomas.elpais.com, idiomas.elpais.com, idiomas.elpais.com, idiomas.elpais.com, idiomas.elpais.com, idiomas.elpais.com, idiomas.elpais.com, idiomas.elpais.com, idiomas.elpais.com, idiomas.elpais.com, idiomas.elpais.com, idiomas.elpais.com, idiomas.elpais.com, idiomas.elpais.com, idiomas.elpais.com, idiomas.elpais.com, idiomas.elpais.com, idiomas.elpais.com, idiomas.elpais.com, idiomas.elpais.com, idiomas.elpais.com, idiomas.elpais.com, idiomas.elpais.com, idiomas.elpais.com, idiomas.elpais.com, idiomas.elpais.com, idiomas.elpais.com, idiomas.elpais.com, idiomas.elpais.com, idiomas.elpais.com, idiomas.elpais.com, idiomas.elpais.com, idiomas.elpais.com, idiomas.elpais.com, idiomas.elpais.com, idiomas.elpais.com, idiomas.elpais.com, idiomas.elpais.com, idiomas.elpais.com, idiomas.elpais.com, idiomas.elpais.com, idiomas.elpais.com, idiomas.elpais.com, idiomas.elpais.com, idiomas.elpais.com, idiomas.elpais.com, idiomas.elpais.com, idiomas.elpais.com, idiomas.elpais.com, idiomas.elpais.com, idiomas.elpais.com, cursoselpais.mx, www.emagister.com.mx, www.emagister.com.mx, www.emagister.com.mx, www.emagister.com.mx, www.emagister.com.mx, www.emagister.com.mx, www.emagister.com.mx, www.emagister.com.mx, www.emagister.com.mx, www.emagister.com.mx, www.emagister.com.mx, www.emagister.com.mx, cursoselpais.mx, www.emagister.com.mx, www.emagister.com.mx, www.emagister.com.mx, www.emagister.com.mx, www.emagister.com.mx, www.emagister.com.mx, www.emagister.com.mx, www.emagister.com.mx, www.emagister.com.mx, cursoselpais.mx, cursoselpais.mx, cursoselpais.mx, idiomas.elpais.com, idiomas.elpais.com, idiomas.elpais.com, idiomas.elpais.com, idiomas.elpais.com, idiomas.elpais.com, idiomas.elpais.com, idiomas.elpais.com, idiomas.elpais.com, idiomas.elpais.com, idiomas.elpais.com, idiomas.elpais.com, idiomas.elpais.com, idiomas.elpais.com, idiomas.elpais.com, idiomas.elpais.com, idiomas.elpais.com, idiomas.elpais.com, idiomas.elpais.com, idiomas.elpais.com, idiomas.elpais.com, idiomas.elpais.com, idiomas.elpais.com, idiomas.elpais.com, idiomas.elpais.com, idiomas.elpais.com, idiomas.elpais.com, idiomas.elpais.com, idiomas.elpais.com, idiomas.elpais.com, idiomas.elpais.com, idiomas.elpais.com, idiomas.elpais.com, idiomas.elpais.com, idiomas.elpais.com, idiomas.elpais.com, idiomas.elpais.com, idiomas.elpais.com, idiomas.elpais.com, plus.elpais.com, plus.elpais.com, plus.elpais.com, plus.elpais.com, www.facebook.com, twitter.com, www.youtube.com, www.instagram.com
english.elpais.com, www.defense.gov, www.hqmc.marines.mil, www.usmcu.edu, rmi.marines.com, www.cmc.marines.mil, www.mynavyhr.navy.mil, www.defense.gov, www.hqmc.marines.mil, www.usmcu.edu, rmi.marines.com, www.cmc.marines.mil, www.mynavyhr.navy.mil, media.defense.gov, media.defense.gov, dodcio.defense.gov, www.usa.gov, prhome.defense.gov, www.hqmc.marines.mil, www.web.dma.mil, www.veteranscrisisline.net
www.marines.mil, www.derbycityweekend.com, www.derbycityweekend.com, gray.tv, wave3advertising.com, www.vuit.com, www.graydc.com, www.circleallaccess.com, www.investigatetv.com, www.facebook.com, www.twitter.com, publicfiles.fcc.gov, webpubcontent.gray.tv, webpubcontent.gray.tv, wave3advertising.com, gray.tv
www.wave3.com, www.facebook.com, palestineherald.collegeexpertsclub.com, celebrations.palestineherald.com, photos.palestineherald.com, celebrations.palestineherald.com, notices.palestineherald.com, photos.palestineherald.com, obituaries.palestineherald.com, visitor.r20.constantcontact.com, newspaperads.palestineherald.com, photos.palestineherald.com, obituaries.palestineherald.com, visitor.r20.constantcontact.com, portal.cityspark.com, celebrations.palestineherald.com, notices.palestineherald.com, visitor.r20.constantcontact.com, www.facebook.com, www.facebook.com, twitter.com, www.linkedin.com, pinterest.com, newspaperads.palestineherald.com, obituaries.palestineherald.com, obituaries.palestineherald.com, obituaries.palestineherald.com, obituaries.palestineherald.com, obituaries.palestineherald.com, obituaries.palestineherald.com, obituaries.palestineherald.com, obituaries.palestineherald.com, obituaries.palestineherald.com, obituaries.palestineherald.com, bcp.crwdcntrl.net, www.rtjgolf.com, www.microsoft.com, www.google.com, www.mozilla.org, bloxcms.com, bloxdigital.com
www.palestineherald.com
riverheadnewsreview.timesreview.com, www.facebook.com, sanmarcos.skydivespaceland.com, www.texastribune.org, www.facebook.com, twitter.com, www.instagram.com, www.youtube.com, interactive.kvue.com
www.kvue.com, www.instagram.com, www.facebook.com, twitter.com, www.youtube.com, www.instagram.com, www.facebook.com, twitter.com, www.youtube.com, www.eisenhowerlibrary.gov, my.community.com, www.facebook.com, twitter.com, www.instagram.com, www.facebook.com, twitter.com, www.youtube.com
www.whitehouse.govscreenrant.com, www.hulu.com, disneyprivacycenter.com, privacy.thewaltdisneycompany.com, disneyprivacycenter.com, preferences-mgr.truste.com, www.nielsen.com, disneytermsofuse.com, privacy.thewaltdisneycompany.com
abcnews.go.com, ww2.stripes.com, ww2.stripes.com, ww2.stripes.com, veteranjobs.stripes.com, ww2.stripes.com, ww2.stripes.com, ww2.stripes.com, ww2.stripes.com, ww2.stripes.com, ww2.stripes.com, ww2.stripes.com, ww2.stripes.com, ww2.stripes.com, ww2.stripes.com, ww2.stripes.com, europe.stripes.com, guam.stripes.com, japan.stripes.com, korea.stripes.com, okinawa.stripes.com, obituaries.stripes.com, militarychild.stripes.com, bestofgermany.stripes.com, bestofpacific.stripes.com, letterstosanta.stripes.com, penpal.stripes.com, printshop.stripes.com, www.stripesstore.com, ww2.stripes.com, ww2.stripes.com, ww2.stripes.com, ww2.stripes.com, ww2.stripes.com, twitter.com, www.facebook.com, www.addtoany.com, www.addtoany.com, www.addtoany.com, www.addtoany.com, www.addtoany.com, www.dpaa.mil, twitter.com, ww2.stripes.com, twitter.com, www.facebook.com, epub.stripes.com, epub.stripes.com, epub.stripes.com, ww2.stripes.com, epub.stripes.com, epub.stripes.com, epub.stripes.com, epub.stripes.com, epub.stripes.com, epub.stripes.com, ww2.stripes.com, ww2.stripes.com, ww2.stripes.com, ww2.stripes.com, ww2.stripes.com, ww2.stripes.com, ww2.stripes.com, ww2.stripes.com, ww2.stripes.com, ww2.stripes.com, ww2.stripes.com, ww2.stripes.com, ww2.stripes.com, ww2.stripes.com, ww2.stripes.com, ww2.stripes.com, ww2.stripes.com, feeds.stripes.com, ww2.stripes.com, veteranjobs.stripes.com, ww2.stripes.com, ww2.stripes.com, ww2.stripes.com, ww2.stripes.com, ww2.stripes.com, ww2.stripes.com, ww2.stripes.com, ww2.stripes.com, ww2.stripes.com, ww2.stripes.com, ww2.stripes.com, ww2.stripes.com, japan.stripes.com, europe.stripes.com, korea.stripes.com, okinawa.stripes.com, guam.stripes.com, obituaries.stripes.com, militarychild.stripes.com, bestofgermany.stripes.com, bestofpacific.stripes.com, letterstosanta.stripes.com, penpal.stripes.com, printshop.stripes.com, www.stripesstore.com, ww2.stripes.com, ww2.stripes.com, dodcio.defense.gov
www.stripes.com, subscribe.pal-item.com, subscribe.pal-item.com, cm.pal-item.com, user.pal-item.com, subscribe.pal-item.com, login.pal-item.com, www.thestarpress.com, www.facebook.com, twitter.com, www.facebook.com, twitter.com, cm.pal-item.com, static.pal-item.com, www.gannett.com, cm.pal-item.com, cm.pal-item.com, cm.pal-item.com, cm.pal-item.com, cm.pal-item.com, cm.pal-item.com, help.pal-item.com, supportlocal.usatoday.com, cm.pal-item.com, cm.pal-item.com, imagn.com, help.pal-item.com, cm.pal-item.com, account.pal-item.com, cm.pal-item.com, subscribe.pal-item.com, profile.pal-item.com, www.facebook.com, twitter.com, user.pal-item.com, www.storytellersproject.com, www.tkqlhce.com, classifieds.pal-item.com, gannettmediaeducation.gannett.com, reviewed.usatoday.com, www.10best.com, localiq.com
www.pal-item.com
thisisreno.com, www.facebook.com, itunes.apple.com, play.google.com, www.facebook.com, twitter.com, interactive.whas11.com
www.whas11.com, www.facebook.com, www.instagram.com, heraldbulletin.smugmug.com, celebrations.heraldbulletin.com, obituaries.heraldbulletin.com, obituaries.heraldbulletin.com, madisonthemagazine-cnhi.newsmemory.com, discoverandersonmagazine-cnhi.newsmemory.com, joom.ag, celebrations.heraldbulletin.com, jobs.heraldbulletin.com, my.textcaster.com, notices.heraldbulletin.com, photos.heraldbulletin.com, obituaries.heraldbulletin.com, visitor.r20.constantcontact.com, niagara-gazette-cnhi.newsmemory.com, newspaperads.heraldbulletin.com, photos.heraldbulletin.com, obituaries.heraldbulletin.com, visitor.r20.constantcontact.com, my.textcaster.com, portal.cityspark.com, celebrations.heraldbulletin.com, obituaries.heraldbulletin.com, obituaries.heraldbulletin.com, notices.heraldbulletin.com, visitor.r20.constantcontact.com, www.facebook.com, www.instagram.com, www.facebook.com, twitter.com, www.linkedin.com, pinterest.com, heraldbulletin-cnhi.newsmemory.com, heraldbulletin-cnhi.newsmemory.com, newspaperads.heraldbulletin.com, obituaries.heraldbulletin.com, obituaries.heraldbulletin.com, obituaries.heraldbulletin.com, obituaries.heraldbulletin.com, obituaries.heraldbulletin.com, obituaries.heraldbulletin.com, obituaries.heraldbulletin.com, obituaries.heraldbulletin.com, obituaries.heraldbulletin.com, obituaries.heraldbulletin.com, obituaries.heraldbulletin.com, obituaries.heraldbulletin.com, photos.heraldbulletin.com, photos.heraldbulletin.com, photos.heraldbulletin.com, www.wthr.com, www.wthr.com, www.wthr.com, bcp.crwdcntrl.net, www.rtjgolf.com, www.microsoft.com, www.google.com, www.mozilla.org, bloxcms.com, bloxdigital.com
www.heraldbulletin.com, subscribe.smithsonianmag.com, ssl.drgnetwork.com, www.smithsonianstore.com, subscribe.smithsonianmag.com, subscribe.smithsonianmag.com, ssl.drgnetwork.com, www.smithsonianjourneys.org, www.si.edu, photocontest.smithsonianmag.com, photocontest.smithsonianmag.com, www.instagram.com, www.smithsonianstore.com, www.imdb.com, amzn.to, subscribe.smithsonianmag.com, subscribe.smithsonianmag.com, subscribe.smithsonianmag.com, photocontest.smithsonianmag.com, subscribe.smithsonianmag.com, subscribe.smithsonianmag.com, ssl.drgnetwork.com, ssl.drgnetwork.com, www.si.edu, www.smithsonian.com, www.smithsonianstore.com, www.smithsonianjourneys.org, www.smithsonianchannel.com, www.smithsonianbooks.com, www.si.edu, www.si.edu, www.si.edu
www.smithsonianmag.com, developers.google.com, tv.youtube.com
www.youtube.com, bioguide.congress.gov, bioguide.congress.gov, bioguide.congress.gov, bioguide.congress.gov, bioguide.congress.gov, bioguide.congress.gov, bioguide.congress.gov, bioguide.congress.gov, bioguide.congress.gov, bioguide.congress.gov, bioguide.congress.gov, bioguide.congress.gov, bioguide.congress.gov, bioguide.congress.gov, bioguide.congress.gov, bioguide.congress.gov, bioguide.congress.gov, bioguide.congress.gov, bioguide.congress.gov, bioguide.congress.gov, bioguide.congress.gov, bioguide.congress.gov, bioguide.congress.gov, bioguide.congress.gov, bioguide.congress.gov, bioguide.congress.gov, bioguide.congress.gov, bioguide.congress.gov, bioguide.congress.gov, bioguide.congress.gov, bioguide.congress.gov, bioguide.congress.gov, bioguide.congress.gov, bioguide.congress.gov, bioguide.congress.gov, bioguide.congress.gov, bioguide.congress.gov, bioguide.congress.gov, bioguide.congress.gov, bioguide.congress.gov, bioguide.congress.gov, bioguide.congress.gov, bioguide.congress.gov, bioguide.congress.gov, bioguide.congress.gov, bioguide.congress.gov, bioguide.congress.gov, bioguide.congress.gov, bioguide.congress.gov, bioguide.congress.gov, bioguide.congress.gov, bioguide.congress.gov, bioguide.congress.gov, bioguide.congress.gov, bioguide.congress.gov, bioguide.congress.gov, bioguide.congress.gov, bioguide.congress.gov, bioguide.congress.gov, bioguide.congress.gov, bioguide.congress.gov, bioguide.congress.gov, bioguide.congress.gov, bioguide.congress.gov, bioguide.congress.gov, bioguide.congress.gov, bioguide.congress.gov, bioguide.congress.gov, bioguide.congress.gov, bioguide.congress.gov, bioguide.congress.gov, bioguide.congress.gov, bioguide.congress.gov, bioguide.congress.gov, bioguide.congress.gov, bioguide.congress.gov, bioguide.congress.gov, bioguide.congress.gov, bioguide.congress.gov, bioguide.congress.gov, bioguide.congress.gov, bioguide.congress.gov, bioguide.congress.gov, bioguide.congress.gov, bioguide.congress.gov, bioguide.congress.gov, bioguide.congress.gov, bioguide.congress.gov, bioguide.congress.gov, bioguide.congress.gov, bioguide.congress.gov, bioguide.congress.gov, bioguide.congress.gov, bioguide.congress.gov, bioguide.congress.gov, bioguide.congress.gov, bioguide.congress.gov, bioguide.congress.gov, bioguide.congress.gov, bioguide.congress.gov, bioguide.congress.gov, bioguide.congress.gov, bioguide.congress.gov, bioguide.congress.gov, bioguide.congress.gov, bioguide.congress.gov, bioguide.congress.gov, bioguide.congress.gov, bioguide.congress.gov, bioguide.congress.gov, bioguide.congress.gov, bioguide.congress.gov, bioguide.congress.gov, bioguide.congress.gov, bioguide.congress.gov
www.senate.gov, www.facebook.com, twitter.com, www.instagram.com, www.youtube.com, www.facebook.com, twitter.com, www.instagram.com, www.youtube.com
www.wicker.senate.gov, subscribe.pal-item.com, subscribe.pal-item.com, cm.pal-item.com, user.pal-item.com, subscribe.pal-item.com, login.pal-item.com, www.thestarpress.com, www.facebook.com, twitter.com, www.facebook.com, twitter.com, cm.pal-item.com, static.pal-item.com, www.gannett.com, cm.pal-item.com, cm.pal-item.com, cm.pal-item.com, cm.pal-item.com, cm.pal-item.com, cm.pal-item.com, help.pal-item.com, supportlocal.usatoday.com, cm.pal-item.com, cm.pal-item.com, imagn.com, help.pal-item.com, cm.pal-item.com, account.pal-item.com, cm.pal-item.com, subscribe.pal-item.com, profile.pal-item.com, www.facebook.com, twitter.com, user.pal-item.com, www.storytellersproject.com, www.tkqlhce.com, classifieds.pal-item.com, gannettmediaeducation.gannett.com, reviewed.usatoday.com, www.10best.com, localiq.com
www.pal-item.com
thisisreno.com, www.facebook.com, itunes.apple.com, play.google.com, www.facebook.com, twitter.com, interactive.whas11.com
