bookstore.gpo.gov, twitter.com, www.instagram.com, www.facebook.com, www.ap.org, customerzone.ap.org, careers.ap.org, contentservices.ap.org, www.ap.org, www.ap.org, www.ap.org, leads.ap.org, blog.ap.org, apimagesblog.com, www.apstylebook.com, www.ap.org, customerzone.ap.org, careers.ap.org, contentservices.ap.org, www.ap.org, www.ap.org, www.ap.org, leads.ap.org, blog.ap.org, apimagesblog.com, www.apstylebook.com, twitter.com, www.instagram.com, www.facebook.com
apnews.com, www.dpaa.mil, www.dpaa.mil, www.dpaa.mil, www.dpaa.mil, dpaa.secure.force.com, www.dpaa.mil, www.dpaa.mil, dpaa.secure.force.com, dpaa.secure.force.com, dpaa.secure.force.com, dpaa.secure.force.com, dpaa.secure.force.com, dpaa.secure.force.com, dpaa.secure.force.com, dpaa.secure.force.com, dpaa.secure.force.com, dpaa.secure.force.com, dpaa-mil.experience.crmforce.mil, dpaa.secure.force.com, dpaa.secure.force.com, dpaa.secure.force.com, dpaa.secure.force.com, dpaa.secure.force.com, dpaa.secure.force.com, dpaa.secure.force.com, www.dpaa.mil, www.dpaa.mil, www.dpaa.mil, www.dpaa.mil, www.dpaa.mil, www.dpaa.mil, www.dpaa.mil, www.dpaa.mil, www.esd.whs.mil, www.dpaa.mil, www.dpaa.mil, www.dpaa.mil, www.dpaa.mil, www.dpaa.mil, www.dpaa.mil, www.dpaa.mil, www.usajobs.gov, www.dpaa.mil, www.dpaa.mil, dpaa.secure.force.com, dpaa-mil.experience.crmforce.mil, dpaa-mil.experience.crmforce.mil, dpaa-mil.experience.crmforce.mil, dcas.dmdc.osd.mil, dpaa.secure.force.com, dpaa.secure.force.com, www.dpaa.mil, www.defense.gov, www.defense.gov, www.defense.gov, www.defense.gov, www.defense.gov, www.dodig.mil, www.defense.gov, recovery.defense.gov, open.defense.gov, www.usa.gov, prhome.defense.gov, www.todaysmilitary.com, dod.usajobs.gov, www.defense.gov, dodcio.defense.gov, www.dpaa.mil, www.facebook.com, twitter.com, www.flickr.com, www.dvidshub.net
dpaa-mil.sites.crmforce.mil, www.amazon.com, www.amazon.com, www.amazon.com, www.amazon.com, www.amazon.com, www.amazon.com, www.militaryindexes.com, memory.loc.gov, www.archives.gov, english.pobediteli.ru, www.bbc.co.uk, www.unionhistory.info, www.wilhelm-radkovsky.de, www.imdb.com, www.imdb.com, en.wikipedia.org, en.wikipedia.org, www.mediawiki.org
www.newworldencyclopedia.org, education.cfr.org, www.facebook.com, twitter.com, www.youtube.com, education.cfr.org, www.facebook.com, twitter.com, www.youtube.com, docs.google.com, docs.google.com, www.mtholyoke.edu, www.jstor.org, www.nationalww2museum.org, afe.easia.columbia.edu, exhibitions.ushmm.org, www.foreignaffairs.com, www.foreignaffairs.com, www.foreignaffairs.com, www.cfr.org, www.cfr.org, books.google.com, www.nationalww2museum.org, encyclopedia.ushmm.org, encyclopedia.ushmm.org, encyclopedia.ushmm.org, www.ushmm.org, www.nationalww2museum.org, creativecommons.org, www.cfr.org, education.cfr.org, www.ala.org, www.edtechdigest.com, www.facebook.com, twitter.com, www.youtube.com
world101.cfr.org, emagazines.com, get.time.com, cloud.newsletters.time.com, emagazines.com, get.time.com, www.timeforkids.com, www.timeedge.com, www.co2.com, get.time.com, get.time.com, timecoverstore.com, support.time.com, support.time.com, www.parsintl.com, www.facebook.com, www.instagram.com, twitter.com, www.pinterest.com, api.time.com, api.time.com, api.time.com, www.ft.com, www.britannica.com, encyclopedia.ushmm.org, polandin.com, encyclopedia.ushmm.org, www.jstor.org, www.npr.org, www.nytimes.com, en.kremlin.ru, www.europarl.europa.eu, www.europarl.europa.eu, en.kremlin.ru, www.bbc.com, en.kremlin.ru, encyclopedia.ushmm.org, www.npr.org, www.timesofisrael.com, www.aljazeera.com, www.nytimes.com, www.facebook.com, cdp-hrc.uottawa.ca, www.ctvnews.ca, www.sltrib.com, www.washingtonpost.com, novayagazeta.ru, www.nytimes.com, www.levada.ru, www.levada.ru, www.mae.ro, carnegie.ru, www.project-syndicate.org, api.time.com, www.timeforkids.com, www.co2.com, timeedge.com, timecoverstore.com, support.time.com, support.time.com, www.parsintl.com, privacyportal.onetrust.com
time.com, www.foxbusiness.com, nation.foxnews.com, radio.foxnews.com, www.foxweather.com, www.outkick.com, www.foxbusiness.com, www.foxbusiness.com, www.foxbusiness.com, www.foxbusiness.com, www.foxbusiness.com, www.foxbusiness.com, www.foxbusiness.com, www.foxbusiness.com, foxcareers.com, press.foxnews.com, press.foxnews.com, www.foxbusiness.com, www.foxweather.com, www.foxsports.com, shop.foxnews.com, radio.foxnews.com, www.outkick.com, radio.foxnews.com, privacy.foxnews.com, help.foxnews.com, www.factset.com, www.factset.com, www.factset.com, lipperalpha.refinitiv.com, www.facebook.com, twitter.com, www.instagram.com, www.foxbusiness.com, www.foxbusiness.com, www.foxbusiness.com, www.foxbusiness.com, www.foxbusiness.com, www.foxbusiness.com, www.foxbusiness.com, www.foxbusiness.com, foxcareers.com, press.foxnews.com, press.foxnews.com, www.foxbusiness.com, www.foxweather.com, www.foxsports.com, shop.foxnews.com, radio.foxnews.com, www.outkick.com, radio.foxnews.com, www.facebook.com, twitter.com, www.instagram.com, www.youtube.com, flipboard.com, www.linkedin.com, foxnews.slack.com, open.spotify.com, www.iheart.com, privacy.foxnews.com, help.foxnews.com, www.factset.com, www.factset.com, www.factset.com, lipperalpha.refinitiv.com
www.foxnews.com, www.abmc.gov
wwiiregistry.abmc.gov
www.dkfindout.com, www.dotdashmeredith.com, www.facebook.com, flipboard.com, privacy.truste.com, www.dotdashmeredith.com, www.dotdashmeredith.com, www.dotdashmeredith.com, www.dotdashmeredith.com, www.dotdashmeredith.com, www.dotdashmeredith.com
www.thoughtco.com, account.ncbi.nlm.nih.gov, support.ncbi.nlm.nih.gov, twitter.com, www.facebook.com, www.linkedin.com, github.com, ncbiinsights.ncbi.nlm.nih.gov, www.nlm.nih.gov, twitter.com, www.facebook.com, www.youtube.com, www.google.com, www.nlm.nih.gov, www.nih.gov, www.hhs.gov, support.nlm.nih.gov, www.nlm.nih.gov, www.nlm.nih.gov, www.nlm.nih.gov, www.nih.gov, www.hhs.gov, www.usa.gov
www.ncbi.nlm.nih.gov, profile.usatoday.com, subscribe.usatoday.com, profile.usatoday.com, puzzles.usatoday.com, user.usatoday.com, www.studiogci.com, reviewed.usatoday.com, coupons.usatoday.com, subscribe.usatoday.com, login.usatoday.com, www.facebook.com, twitter.com, www.history.com, www.britannica.com, history.state.gov, www.history.com, www.history.com, www.history.com, www.history.com, www.history.com, www.history.com, www.history.com, www.history.com, www.history.com, www.history.com, www.history.com, www.history.com, www.history.com, www.history.com, www.history.com, www.britannica.com, www.britannica.com, www.britannica.com, www.history.com, www.history.com, www.history.com, www.history.com, www.nationalww2museum.org, www.nationalww2museum.org, www.ushmm.org, www.facebook.com, twitter.com, cm.usatoday.com, www.gannett.com, cm.usatoday.com, gannett.com, cm.usatoday.com, cm.usatoday.com, cm.usatoday.com, cm.usatoday.com, cm.usatoday.com, help.usatoday.com, help.usatoday.com, account.usatoday.com, cm.usatoday.com, offers.usatoday.com, user.usatoday.com, usatodaystore.com, onlinestore.usatoday.com, imagn.com, marketing.usatoday.com, www.gannett.com, www.gannett.com, supportlocal.usatoday.com, newstips.usatoday.com, profile.usatoday.com, cm.usatoday.com, www.facebook.com, www.x.com, www.instagram.com, www.linkedin.com, www.threads.net, post.news, www.youtube.com, www.reddit.com, flipboard.com, www.10best.com, reviewed.usatoday.com, cm.usatoday.com, www.studiogci.com, classifieds.usatoday.com, coupons.usatoday.com
www.usatoday.com
www.callofduty.com
study.com
dcas.dmdc.osd.mil, give.nationalgeographic.org, classroom.google.com, teams.microsoft.com, www.nationalgeographic.com, blog.nationalgeographic.org, support.nationalgeographic.org, exhibitions.nationalgeographic.org, give.nationalgeographic.org, give.nationalgeographic.org, www.instagram.com, www.linkedin.com, www.facebook.com, www.youtube.com, www.threads.net, twitter.com
www.nationalgeographic.org, www.gwu.edu
www2.gwu.edu, corporate.dw.com, corporate.dw.com, corporate.dw.com, learngerman.dw.com, akademie.dw.com, corporate.dw.com, corporate.dw.com, corporate.dw.com, corporate.dw.com, corporate.dw.com, corporate.dw.com, dwadsales.com, facebook.com, www.youtube.com, www.instagram.com, twitter.com
www.dw.com
www.familysearch.org
www.ancestry.com, archive.nationalgeographic.com, www.nationalgeographic.org, disneytermsofuse.com, privacy.thewaltdisneycompany.com, privacy.thewaltdisneycompany.com, disneyprivacycenter.com, preferences-mgr.trustarc.com, www.nielsen.com, privacy.thewaltdisneycompany.com, www.natgeomaps.com, kids.nationalgeographic.com, www.shopdisney.com, www.nationalgeographic.org, www.nationalgeographic.org, nationalgeographicpartners.com, www.disneyadsales.com, help.nationalgeographic.com, ngmservice.com, give.nationalgeographic.org
www.nationalgeographic.com, www.stanford.edu, history.stanford.edu, www.hmhbooks.com, sustainability.stanford.edu, sustainability.stanford.edu, stanfordmag.org, stanfordmag.org, ucomm.stanford.edu, events.stanford.edu, ucomm.stanford.edu, www.stanford.edu, www.stanford.edu, visit.stanford.edu, www.stanford.edu, emergency.stanford.edu, www.stanford.edu, www.stanford.edu, uit.stanford.edu, adminguide.stanford.edu, studentservices.stanford.edu, www.stanford.edu
news.stanford.edu, accounts.theatlantic.com, accounts.theatlantic.com, accounts.theatlantic.com, accounts.theatlantic.com, accounts.theatlantic.com, bookshop.org, web.tertulia.com, news.stanford.edu, www.nobelpeacecenter.org, www.historians.org, www.wsj.com, www.npr.org, www.theguardian.com, www.atlasobscura.com, www.aljazeera.com, newrepublic.com, www.nytimes.com, bookshop.org
www.theatlantic.com, enable-javascript.com, www.gallup.com, www.gallup.com, www.gallup.com, www.gallup.com, www.gallup.com, www.gallup.com, www.gallup.com, www.gallup.com, www.gallup.com, www.gallup.com, www.gallup.com, www.gallup.com, www.gallup.com, www.gallup.com, www.gallup.com, www.gallup.com, store.gallup.com, www.gallup.com, www.gallup.com, www.gallup.com, www.gallup.com, www.gallup.com, www.gallupatwork.com, www.gallup.com, www.gallup.com, www.gallup.com, www.gallup.com, www.gallup.com, www.gallup.com, www.gallup.com, www.gallup.com, www.gallup.com, www.gallup.com, www.gallup.com, www.gallup.com, www.gallup.com, www.gallup.com, store.gallup.com, www.gallup.com, www.gallup.com, www.gallup.com, www.gallup.com, www.gallup.com, www.gallup.com, www.gallup.com, www.gallup.com, www.gallup.com, www.gallup.com, www.gallup.com, www.gallup.com, www.gallup.com, www.gallup.com, www.gallup.com, www.gallup.com, www.gallup.com, store.gallup.com, www.gallup.com, www.gallup.com, www.gallup.com, www.gallup.com, www.gallup.com, www.gallupatwork.com, www.gallup.com, www.gallup.com, www.gallup.com, www.gallup.com, www.gallup.com, www.gallup.com, www.gallup.com, www.gallup.com, www.gallup.com, www.gallup.com, www.gallup.com, www.gallup.com, www.gallup.com, www.gallup.com, store.gallup.com, www.gallup.com, www.gallup.com, www.gallup.com, www.gallup.com, www.gallup.com, my.gallup.com, www.facebook.com, twitter.com, www.linkedin.com, www.facebook.com, twitter.com, www.linkedin.com, www.gallup.com, www.gallup.com, www.gallup.com, www.gallup.com, www.gallup.com, www.gallup.com, www.gallup.com, www.gallup.com, www.gallup.com, store.gallup.com, www.gallup.com, www.gallup.com, www.gallup.com, www.gallup.com, www.facebook.com, www.twitter.com, www.linkedin.com, www.instagram.com, www.youtube.com, www.gallup.com, www.gallup.com, www.gallup.com
news.gallup.com
www.historyplace.com, mediakit.foreignaffairs.com, www.facebook.com, twitter.com, www.instagram.com, www.linkedin.com, www.youtube.com, www.reddit.com, flipboard.com, open.spotify.com, www.cfr.org, mediakit.foreignaffairs.com, donatenow.networkforgood.org, itunes.apple.com, play.google.com, www.facebook.com, twitter.com, www.instagram.com, www.linkedin.com, www.youtube.com, www.reddit.com, flipboard.com, open.spotify.com, www.cfr.org, www.cfr.org, www.cfr.org
www.foreignaffairs.com, usability.yale.edu, www.law.yale.edu, library.law.yale.edu, www.library.yale.edu, www.law.yale.edu, morris.law.yale.edu, orbis.library.yale.edu
avalon.law.yale.edu, experiments.withgoogle.com, www.google.com, myactivity.google.com, www.google.com, www.google.com, policies.google.com, www.google.com, accounts.google.com, www.youtube.com, www.youtube.com, www.youtube.com, www.youtube.com, www.youtube.com, www.youtube.com
artsandculture.google.com, www.surveymonkey.com, uncpress.org, uncpress.org, www.history.com, www.britannica.com, www.britannica.com, www.pbs.org, wwii.unctv.org, wwii.unctv.org, www.britannica.com, www.youtube.com, www.facebook.com, twitter.com, www.pinterest.com, www.youtube.com, www.flickr.com, www.freepik.com, statelibrary.ncdcr.gov, www.dncr.nc.gov, www.nclive.org, www.imls.gov
www.ncpedia.org, www.mla.org, www.chicagomanualofstyle.org, apastyle.apa.org, www.mla.org, www.chicagomanualofstyle.org, apastyle.apa.org, www.mla.org, www.chicagomanualofstyle.org, apastyle.apa.org, www.mla.org, www.chicagomanualofstyle.org, apastyle.apa.org, www.mla.org, www.chicagomanualofstyle.org, apastyle.apa.org, www.mla.org, www.chicagomanualofstyle.org, apastyle.apa.org, www.mla.org, www.chicagomanualofstyle.org, apastyle.apa.org, www.mla.org, www.chicagomanualofstyle.org, apastyle.apa.org, www.mla.org, www.chicagomanualofstyle.org, apastyle.apa.org, www.mla.org, www.chicagomanualofstyle.org, apastyle.apa.org, www.facebook.com, twitter.com, instagram.com
www.encyclopedia.com, ru.fallen.io, de.fallen.io, ja.fallen.io, pl.fallen.io, fr.fallen.io, sr.fallen.io, ru.fallen.io, de.fallen.io, ja.fallen.io, pl.fallen.io, fr.fallen.io, sr.fallen.io, twitter.com, www.pinterest.com, twitter.com, andydollerson.bandcamp.com, www.amazon.com, en.wikipedia.org, www.google.com, www.pcr.uu.se
www.fallen.io, support.shmoop.com, support.shmoop.com, community.shmoop.com, support.shmoop.com, support.shmoop.com, www.amazon.com, www.amazon.com, www.amazon.com, www.amazon.com, www.amazon.com, www.amazon.com, www.amazon.com, www.amazon.com, www.amazon.com, www.archives.gov, img.timeinc.net, www.imdb.com, www.imdb.com, www.imdb.com, www.imdb.com, www.imdb.com, www.imdb.com, www.archives.gov, www.pbs.org, millercenter.org, support.shmoop.com, support.shmoop.com, community.shmoop.com, support.shmoop.com, shmoop.zendesk.com, www.youtube.com, www.instagram.com, www.facebook.com, twitter.com, www.linkedin.com
www.shmoop.com, accessibility.harvard.edu, www.gocrimson.com, www.harvard.edu, trademark.harvard.edu, www.harvard.edu, twitter.com, facebook.com, www.linkedin.com, instagram.com, facebook.com, twitter.com, www.linkedin.com, www.harvard.edu, twitter.com, facebook.com, www.linkedin.com, instagram.com
news.harvard.edu
www.historynet.com, iowapbsfoundation.tfaforms.net, iowapbsfoundation.tfaforms.net, www.loc.gov, diyhistory.lib.uiowa.edu, iowapublicradio.org, iowapublicradio.org, iowapublicradio.org, iowapublicradio.org, iowapublicradio.org, iowapublicradio.org, iowapublicradio.org, www.iowaheritage.org, www.iowaheritage.org, www.pbs.org, iagenweb.org, usgerrelations.traces.org, berkshirehistory.org, isuspecialcollections.wordpress.com, 515.725.9700, 800.532.1290, iowapbsfoundation.tfaforms.net, www.facebook.com, www.instagram.com, www.youtube.com, www.linkedin.com, twitter.com
www.iowapbs.org, www.cia.gov, www.amazon.com, users.erols.com, www.worldcat.org, books.google.com, books.google.com, books.google.com, books.google.com, motlc.wiesenthal.com, books.google.com, books.google.com, nobsopus.blogspot.com, mtracey.substack.com, books.google.com, history.org.ua, web.archive.org, motlc.learningcenter.wiesenthal.org, web.archive.org, www.volhyniamassacre.eu, web.archive.org, web.archive.org, worldwartwo.filminspector.com, ww2db.com, books.google.com, www.russiatoday.com, www.pbs.org, www.usni.org, www.history.navy.mil, www.onpower.org, www.independent.org, userwww.sfsu.edu, encyc.org, www.independent.org, www.independent.org, www.independent.org, www.independent.org, www.independent.org
www.conservapedia.com
www.docsteach.org
www.barnesandnoble.com, www.facebook.com, twitter.com, reddit.com, getpocket.com, share.flipboard.com, www.youtube.com, en.wikipedia.org, www.youtube.com, www2.warwick.ac.uk, en.wikipedia.org, www.usma.edu, commons.wikimedia.org, en.wikipedia.org, en.wikipedia.org, commons.wikimedia.org, commons.wikimedia.org, www.westpoint.edu, www.westpoint.edu, commons.wikimedia.org, bombsight.org, bombsight.org, en.wikipedia.org, commons.wikimedia.org, commons.wikimedia.org, moodle.kkc.school.nz, www.delsjourney.com, www.history.army.mil, www.nationalmuseum.af.mil, en.wikipedia.org, en.wikipedia.org, commons.wikimedia.org, www.westpoint.edu, commons.wikimedia.org, www.westpoint.edu, time.com, www.westpoint.edu, en.wikipedia.org, commons.wikimedia.org, commons.wikimedia.org, en.wikipedia.org, cryptomuseum.com, commons.wikimedia.org, en.wikipedia.org, commons.wikimedia.org, commons.wikimedia.org, www.usma.edu, commons.wikimedia.org, en.wikipedia.org, en.wikipedia.org, en.wikipedia.org, en.wikipedia.org, mondediplo.com, en.wikipedia.org, commons.wikimedia.org, faculty.catawba.edu, commons.wikimedia.org, commons.wikimedia.org, commons.wikimedia.org, www.nytimes.com, commons.wikimedia.org, commons.wikimedia.org, twitter.com, twitter.com, twitter.com, twitter.com, twitter.com, vox.memberful.com, www.paypal.com, www.facebook.com, twitter.com, bit.ly, www.voxmedia.com, www.voxmedia.com, www.voxmedia.com, www.voxmedia.com, www.voxmedia.com, www.voxmedia.com, www.voxmedia.com, status.voxmedia.com, www.voxmedia.com, jobs.voxmedia.com, voxmedia.stories.usechorus.com, www.voxmedia.com
www.vox.com, support.abebooks.com, support.abebooks.com, www.facebook.com, twitter.com, www.linkedin.com, www.facebook.com, twitter.com, www.linkedin.com, www.amazon.jobs, forums.abebooks.com, support.abebooks.com, www.abebooks.co.uk, www.abebooks.de, www.abebooks.fr, www.abebooks.it, www.abebooks.ca, www.iberlibro.com, www.zvab.com, www.bookfinder.com, www.facebook.com, twitter.com, www.instagram.com, www.abebooks.co.uk, www.abebooks.de, www.abebooks.fr, www.abebooks.it, www.abebooks.ca, www.iberlibro.com, www.zvab.com, www.bookfinder.com
www.abebooks.comwww.westpoint.edu, policies.google.com, myaccount.google.com, support.google.com, support.google.com, www.edkongames.com, maps.google.com, www.edkongames.com, support.google.com, support.google.com, support.google.com, support.google.com, policies.google.com, support.google.com, developer.android.com, store.google.com
play.google.com, www.va.gov, www.va.gov, public.govdelivery.com, www.facebook.com, www.twitter.com, news.va.gov, www.flickr.com, www.youtube.com, www.instagram.com, www.va.gov, www.va.gov, www.va.gov, www.myhealth.va.gov, www.va.gov, www.va.gov, www.veteranscrisisline.net, www.mentalhealth.va.gov, www.ptsd.va.gov, www.publichealth.va.gov, www.va.gov, www.caregiver.va.gov, www.va.gov, www.va.gov, www.cem.va.gov, www.cem.va.gov, www.cem.va.gov, www.cem.va.gov, www.cem.va.gov, www.cem.va.gov, gravelocator.cem.va.gov, www.cem.va.gov, www.cem.va.gov, www.va.gov, www.va.gov, www.va.gov, www.va.gov, www.va.gov, www.va.gov, www.va.gov, www.va.gov, www.va.gov, www.va.gov, www.va.gov, www.va.gov, www.va.gov, www.va.gov, www.va.gov, www.va.gov, mobile.va.gov, www.nrd.gov, www.va.gov, www.va.gov, www.va.gov, www.va.gov, www.va.gov, www.va.gov, www.va.gov, www.youtube.com, www.va.gov, www.va.gov, www.va.gov, www.va.gov, www.blogs.va.gov, www.blogs.va.gov, www.blogs.va.gov, www.blogs.va.gov, www.veteransgolfclinic.org, wheelchairgames.org, www.wintersportsclinic.org, www.va.gov, www.va.gov, www.va.gov, www.va.gov, www.va.gov, www.va.gov, www.va.gov, www.va.gov, www.va.gov, www.va.gov, www.va.gov, www.va.gov, www.va.gov, www.va.gov, www.va.gov, www.va.gov, www.va.gov, www.va.gov, www.va.gov, www.va.gov, www.va.gov, www.va.gov, www.va.gov, www.va.gov, www.va.gov, www.va.gov, www.ebenefits.va.gov, www.va.gov, www.va.gov, www.va.gov, www.va.gov, www.va.gov, www.va.gov, www.va.gov, www.va.gov, www.va.gov, www.va.gov, www.va.gov, www.va.gov, www.insurance.va.gov, www.vets.gov, www.vba.va.gov, www.vba.va.gov, www.va.gov, www.va.gov, gibill.va.gov, www.va.gov, www.publichealth.va.gov, www.publichealth.va.gov, www.va.gov, www.ebenefits.va.gov, www.va.gov, www.va.gov, www2.va.gov, www.publichealth.va.gov, www.veteranscrisisline.net, public.govdelivery.com, www.facebook.com, www.twitter.com, news.va.gov, www.flickr.com, www.youtube.com, www.instagram.com, www.va.gov, www.va.gov, www.oprm.va.gov, www.va.gov, www.va.gov, www.va.gov, www.va.gov, www.va.gov, www.va.gov, www.va.gov, www.va.gov, www.va.gov, www.va.gov, www.myhealth.va.gov, www.myhealth.va.gov, www.va.gov, www.va.gov, www.va.gov, www.va.gov, www.va.gov, www.va.gov, www.vets.gov, www.oefoif.va.gov, www.va.gov, www.va.gov, www.va.gov, www.va.gov, www.va.gov, www.va.gov, www.va.gov, www.cem.va.gov, www.veteranscrisisline.net, www.veteranscrisisline.net
www.benefits.va.gov, quiz.u-s-history.com, www.ohwy.com
www.u-s-history.comwww.aa.com.tr, sightline.dragonforms.com, sightline.dragonforms.com, airforcetimes.com, armytimes.com, marinecorpstimes.com, www.defensenews.com, www.militarytimes.com, www.militarytimes.com, www.militarytimes.com, payitforward.militarytimes.com, www.militarytimes.com, caucus.militarytimes.com, www.militarytimes.com, www.militarytimes.com, valor.militarytimes.com, www.militarytimes.com, caucus.militarytimes.com, www.militarytimes.com, smoy.militarytimes.com, obits.militarytimes.com, installationguide.militarytimes.com, link.navytimes.com, navytimes-va.newsmemory.com, installationguide.militarytimes.com, www.history.navy.mil, theveteransmuseum.org, www.facebook.com, twitter.com, sightline.dragonforms.com, boards.greenhouse.io, jobboard.militarytimes.com
www.navytimes.com, www.measuringworth.com, fraser.stlouisfed.org, fraser.stlouisfed.org, fraser.stlouisfed.org, fraser.stlouisfed.org, fraser.stlouisfed.org, fraser.stlouisfed.org, twitter.com, research.stlouisfed.org
www.federalreservehistory.org, offers.militarytimes.com, offers.militarytimes.com, armytimes.com, navytimes.com, airforcetimes.com, marinecorpstimes.com, www.defensenews.com, payitforward.militarytimes.com, caucus.militarytimes.com, smoy.militarytimes.com, thefallen.militarytimes.com, valor.militarytimes.com, obits.militarytimes.com, installationguide.militarytimes.com, link.militarytimes.com, installationguide.militarytimes.com, en.wikipedia.org, www.natgeotv.com, www.theguardian.com, www.facebook.com, twitter.com, offers.militarytimes.com, boards.greenhouse.io, jobboard.militarytimes.com
www.militarytimes.com, en.wikipedia.org, www.historians.org, creativecommons.org, twitter.com, www.facebook.com, creativecommons.org, www.mediawiki.org
en.citizendium.org, help.netflix.com, help.netflix.com, media.netflix.com, ir.netflix.com, jobs.netflix.com, netflix.shop, help.netflix.com, help.netflix.com, help.netflix.com, help.netflix.com, fast.com, help.netflix.com
www.netflix.com, buy.acmeticketing.com, store.pacificwarmuseum.org, buy.acmeticketing.com, buy.acmeticketing.com, store.pacificwarmuseum.org, g.page, www.thc.texas.gov, store.pacificwarmuseum.org, www.facebook.com, www.instagram.com, www.linkedin.com, www.youtube.com, affiliations.si.edu, www.aam-us.org, museums4all.org
www.pacificwarmuseum.org, www.google.com, www.facebook.com, twitter.com, www.tripadvisor.com, www.instagram.com, www.youtube.com, www.tripadvisor.com, www.facebook.com, www.instagram.com, twitter.com, www.youtube.com
www.worldwariiaviation.org
www.redcross.org, www.facebook.com, twitter.com, classroom.google.com, www.thememoryproject.com, www.anrdoezrs.net, www.thememoryproject.com, www.Junobeach.org, www.cbc.ca, www.veterans.gc.ca, www.warmuseum.ca, www.cognitoforms.com, twitter.com, www.facebook.com, www.youtube.com, www.historicacanada.ca, www.our-story.ca, canadiancitizenshipchallenge.ca, www.ewc-rdc.ca, www.historicacanada.ca, passagestocanada.com, www.thememoryproject.com, www.canada.ca
www.thecanadianencyclopedia.ca, steamcommunity.com, steamcommunity.com, steamcommunity.com, steamcommunity.com, steamcommunity.com, steamcommunity.com, steamcommunity.com, help.steampowered.com, www.valvesoftware.com, steamcommunity.com, steamcommunity.com, steamcommunity.com, steamcommunity.com, steamcommunity.com, steamcommunity.com, steamcommunity.com, help.steampowered.com, www.valvesoftware.com, www.valvesoftware.com, www.valvesoftware.com, www.valvesoftware.com, www.steampowered.com, partner.steamgames.com, help.steampowered.com, steamcommunity.com, twitter.com
store.steampowered.com, smu.primo.exlibrisgroup.com, twitter.com, www.facebook.com, www.instagram.com, www.flickr.com, www.youtube.com, facebook.com, twitter.com, www.youtube.com, feeds.feedburner.com, plus.google.com, digitalcollections.smu.edu, digitalcollections.smu.edu, digitalcollections.smu.edu, digitalcollections.smu.edu, digitalcollections.smu.edu, digitalcollections.smu.edu, digitalcollections.smu.edu, digitalcollections.smu.edu, digitalcollections.smu.edu, digitalcollections.smu.edu, digitalcollections.smu.edu, digitalcollections.smu.edu, digitalcollections.smu.edu, digitalcollections.smu.edu, smu.libwizard.com
www.smu.edu, data.oregon.gov, dc.library.northwestern.edu, dc.library.northwestern.edu, dc.library.northwestern.edu, dc.library.northwestern.edu
sos.oregon.gov
www.un.org, www.AmericanYawp.com, www.loc.gov, commons.wikimedia.org, www.loc.gov, commons.wikimedia.org, commons.wikimedia.org, upload.wikimedia.org, commons.wikimedia.org, commons.wikimedia.org, commons.wikimedia.org, wordpress.org, creativecommons.org, www.sup.org
