en.wikipedia.org, donate.wikimedia.org, kbd.wikipedia.org, af.wikipedia.org, als.wikipedia.org, am.wikipedia.org, smn.wikipedia.org, ang.wikipedia.org, ar.wikipedia.org, an.wikipedia.org, hyw.wikipedia.org, frp.wikipedia.org, as.wikipedia.org, ast.wikipedia.org, gn.wikipedia.org, av.wikipedia.org, az.wikipedia.org, azb.wikipedia.org, ban.wikipedia.org, bn.wikipedia.org, zh-min-nan.wikipedia.org, map-bms.wikipedia.org, ba.wikipedia.org, be.wikipedia.org, be-tarask.wikipedia.org, bh.wikipedia.org, bcl.wikipedia.org, bi.wikipedia.org, bg.wikipedia.org, bar.wikipedia.org, bo.wikipedia.org, bs.wikipedia.org, br.wikipedia.org, bxr.wikipedia.org, ca.wikipedia.org, cv.wikipedia.org, ceb.wikipedia.org, cs.wikipedia.org, cbk-zam.wikipedia.org, ny.wikipedia.org, sn.wikipedia.org, co.wikipedia.org, cy.wikipedia.org, da.wikipedia.org, ary.wikipedia.org, se.wikipedia.org, pdc.wikipedia.org, de.wikipedia.org, nv.wikipedia.org, dsb.wikipedia.org, dty.wikipedia.org, et.wikipedia.org, el.wikipedia.org, eml.wikipedia.org, es.wikipedia.org, eo.wikipedia.org, ext.wikipedia.org, eu.wikipedia.org, fa.wikipedia.org, hif.wikipedia.org, fo.wikipedia.org, fr.wikipedia.org, fy.wikipedia.org, fur.wikipedia.org, ga.wikipedia.org, gv.wikipedia.org, gd.wikipedia.org, gl.wikipedia.org, gan.wikipedia.org, gu.wikipedia.org, hak.wikipedia.org, ko.wikipedia.org, ha.wikipedia.org, hy.wikipedia.org, hi.wikipedia.org, hsb.wikipedia.org, hr.wikipedia.org, io.wikipedia.org, ig.wikipedia.org, ilo.wikipedia.org, id.wikipedia.org, ia.wikipedia.org, os.wikipedia.org, is.wikipedia.org, it.wikipedia.org, he.wikipedia.org, jv.wikipedia.org, kbp.wikipedia.org, kn.wikipedia.org, krc.wikipedia.org, ka.wikipedia.org, ks.wikipedia.org, kk.wikipedia.org, kw.wikipedia.org, sw.wikipedia.org, ht.wikipedia.org, gcr.wikipedia.org, ku.wikipedia.org, ky.wikipedia.org, lld.wikipedia.org, lad.wikipedia.org, lo.wikipedia.org, la.wikipedia.org, lv.wikipedia.org, lb.wikipedia.org, lez.wikipedia.org, lt.wikipedia.org, lij.wikipedia.org, li.wikipedia.org, lfn.wikipedia.org, olo.wikipedia.org, jbo.wikipedia.org, lmo.wikipedia.org, hu.wikipedia.org, mai.wikipedia.org, mk.wikipedia.org, mg.wikipedia.org, ml.wikipedia.org, mt.wikipedia.org, mi.wikipedia.org, mr.wikipedia.org, xmf.wikipedia.org, arz.wikipedia.org, mzn.wikipedia.org, ms.wikipedia.org, min.wikipedia.org, cdo.wikipedia.org, mwl.wikipedia.org, mn.wikipedia.org, my.wikipedia.org, nah.wikipedia.org, nl.wikipedia.org, nds-nl.wikipedia.org, ne.wikipedia.org, new.wikipedia.org, ja.wikipedia.org, nap.wikipedia.org, nqo.wikipedia.org, ce.wikipedia.org, frr.wikipedia.org, pih.wikipedia.org, no.wikipedia.org, nn.wikipedia.org, oc.wikipedia.org, mhr.wikipedia.org, or.wikipedia.org, uz.wikipedia.org, pa.wikipedia.org, pfl.wikipedia.org, pnb.wikipedia.org, blk.wikipedia.org, pap.wikipedia.org, ps.wikipedia.org, jam.wikipedia.org, km.wikipedia.org, pcd.wikipedia.org, pms.wikipedia.org, nds.wikipedia.org, pl.wikipedia.org, pt.wikipedia.org, kaa.wikipedia.org, crh.wikipedia.org, ksh.wikipedia.org, ro.wikipedia.org, rm.wikipedia.org, qu.wikipedia.org, rue.wikipedia.org, ru.wikipedia.org, sah.wikipedia.org, szy.wikipedia.org, sa.wikipedia.org, sat.wikipedia.org, sc.wikipedia.org, sco.wikipedia.org, stq.wikipedia.org, sq.wikipedia.org, scn.wikipedia.org, si.wikipedia.org, simple.wikipedia.org, sd.wikipedia.org, sk.wikipedia.org, sl.wikipedia.org, cu.wikipedia.org, szl.wikipedia.org, so.wikipedia.org, ckb.wikipedia.org, sr.wikipedia.org, sh.wikipedia.org, su.wikipedia.org, fi.wikipedia.org, sv.wikipedia.org, tl.wikipedia.org, ta.wikipedia.org, kab.wikipedia.org, roa-tara.wikipedia.org, tt.wikipedia.org, te.wikipedia.org, th.wikipedia.org, din.wikipedia.org, tg.wikipedia.org, tr.wikipedia.org, tk.wikipedia.org, kcg.wikipedia.org, tyv.wikipedia.org, uk.wikipedia.org, ur.wikipedia.org, ug.wikipedia.org, za.wikipedia.org, vec.wikipedia.org, vep.wikipedia.org, vi.wikipedia.org, vo.wikipedia.org, fiu-vro.wikipedia.org, wa.wikipedia.org, zh-classical.wikipedia.org, vls.wikipedia.org, war.wikipedia.org, wo.wikipedia.org, wuu.wikipedia.org, yi.wikipedia.org, yo.wikipedia.org, zh-yue.wikipedia.org, diq.wikipedia.org, zea.wikipedia.org, bat-smg.wikipedia.org, zh.wikipedia.org, tly.wikipedia.org, www.wikidata.org, www.wikidata.org, commons.wikimedia.org, en.wikinews.org, en.wikiquote.org, en.wikiversity.org, en.wikivoyage.org, phabricator.wikimedia.org, www.mediawiki.org, archive.org, go.gale.com, doi.org, web.archive.org, archive.org, www.npr.org, web.archive.org, www.jstor.org, doi.org, www.jstor.org, web.archive.org, usa.usembassy.de, web.archive.org, asiatimes.com, web.archive.org, www.nytimes.com, web.archive.org, www.irishtimes.com, web.archive.org, books.google.com, books.google.com, books.google.com, thediplomat.com, web.archive.org, www.militaryhistoryonline.com, web.archive.org, doi.org, www.jstor.org, api.semanticscholar.org, www.ibiblio.org, web.archive.org, ww2db.com, web.archive.org, www.ibiblio.org, web.archive.org, books.google.com, www.history.co.uk, web.archive.org, doi.org, www.jstor.org, api.semanticscholar.org, www.warhistoryonline.com, web.archive.org, books.google.com, books.google.com, www.ibiblio.org, www.ibiblio.org, web.archive.org, www.ibiblio.org, web.archive.org, www.history.army.mil, doi.org, api.semanticscholar.org, www.ibiblio.org, www.ibiblio.org, www.ibiblio.org, web.archive.org, archive.org, archive.org, www.ibiblio.org, web.archive.org, www.ibiblio.org, web.archive.org, www.ibiblio.org, web.archive.org, www.ibiblio.org, web.archive.org, www.asahi.com, web.archive.org, www.ibiblio.org, web.archive.org, en.wikisource.org, www.ibiblio.org, www.ibiblio.org, web.archive.org, www.ibiblio.org, web.archive.org, www.ibiblio.org, web.archive.org, www.ibiblio.org, web.archive.org, www.ibiblio.org, web.archive.org, books.google.com, archive.org, archive.org, web.archive.org, www.ibiblio.org, web.archive.org, www.mzv.sk, web.archive.org, countrystudies.us, web.archive.org, web.archive.org, www.china1931.cn, www.wired.com, web.archive.org, web.archive.org, www.navy.mil, doi.org, api.semanticscholar.org, www.geographiapolonica.pl, doi.org, web.archive.org, web.archive.org, www.igipz.pan.pl, rcin.org.pl, web.archive.org, www.geographiapolonica.pl, doi.org, web.archive.org, www.britannica.com, www.un.org, web.archive.org, web.archive.org, www.un.org, www.un.org, web.archive.org, web.archive.org, www.unfoundation.org, www.britannica.com, 2001-2009.state.gov, web.archive.org, books.google.com, archive.org, archive.org, web.archive.org, web.jjay.cuny.edu, necrometrics.com, web.archive.org, secondworldwar.co.uk, web.archive.org, books.google.com, fcit.usf.edu, arquivo.pt, www.nybooks.com, web.archive.org, www.ushmm.org, web.archive.org, www.bbc.co.uk, web.archive.org, books.google.com, hrcak.srce.hr, web.archive.org, volhyniamassacre.eu, web.archive.org, dzieje.pl, web.archive.org, www.hawaii.edu, web.archive.org, www.historynet.com, web.archive.org, archive.today, search.japantimes.co.jp, books.google.com, www.gegenwind.info, www.historians.org, web.archive.org, books.google.com, web.archive.org, www.dw-world.de, www.dw.com, scepsis.ru, web.archive.org, web.archive.org, www.pbs.org, web.archive.org, www.fas.harvard.edu, lcweb2.loc.gov, web.archive.org, books.google.com, doi.org, www.iwm.org.uk, web.archive.org, doi.org, doi.org, www.worldcat.org, api.semanticscholar.org, www.amnesty.org, web.archive.org, web.archive.org, history.sandiego.edu, go.gale.com, www.au.af.mil, web.archive.org, www.insightsonindia.com, web.archive.org, web.archive.org, www.acs.org, archive.org, doi.org, www.jstor.org, doi.org, www.jstor.org, archive.org, archive.org, archive.org, web.archive.org, universitypublishingonline.org, archive.org, doi.org, hdiplo.org, doi.org, ui.adsabs.harvard.edu, doi.org, doi.org, www.jstor.org, archive.org, archive.org, doi.org, www.jstor.org, api.semanticscholar.org, archive.org, archive.org, www.questia.com, web.archive.org, archive.org, www.worldcat.org, archive.org, doi.org, www.jstor.org, web.archive.org, doi.org, www.jstor.org, api.semanticscholar.org, artukraine.com, web.archive.org, sovietinfo.tripod.com, doi.org, www.jstor.org, pubmed.ncbi.nlm.nih.gov, web.archive.org, ru.wikipedia.org, doi.org, www.jstor.org, archive.org, archive.org, archive.org, web.archive.org, www.worldcat.org, www-cgsc.army.mil, archive.org, web.archive.org, www.strom.clemson.edu, archive.org, web.archive.org, www.worldcat.org, www-cgsc.army.mil, archive.org, archive.org, archive.org, archive.org, doi.org, www.jstor.org, api.semanticscholar.org, archive.org, archive.org, archive.org, doi.org, api.semanticscholar.org, archive.org, www.amazon.com, www.worldcat.org, archive.org, archive.org, archive.org, ru.wikipedia.org, archive.org, archive.org, archive.org, archive.org, archive.org, www.jstor.org, doi.org, www.jstor.org, doi.org, www.jstor.org, api.semanticscholar.org, archive.org, web.archive.org, www.history.army.mil, lccn.loc.gov, www.history.army.mil, archive.org, archive.org, archive.org, archive.org, doi.org, www.jstor.org, archive.org, www.jstor.org, archive.org, www.ibiblio.org, web.archive.org, archive.org, archive.org, archive.org, archive.org, archive.org, archive.org, doi.org, doi.org, archive.org, doi.org, www.jstor.org, api.semanticscholar.org, archive.org, archive.org, archive.org, web.archive.org, www.strategicstudiesinstitute.army.mil, archive.org, archive.org, doi.org, www.jstor.org, archive.org, www.ibiblio.org, web.archive.org, doi.org, www.jstor.org, archive.org, archive.org, doi.org, www.jstor.org, api.semanticscholar.org, www.jstor.org, doi.org, www.jstor.org, archive.org, archive.org, doi.org, www.jstor.org, api.semanticscholar.org, doi.org, www.jstor.org, doi.org, www.jstor.org, api.semanticscholar.org, doi.org, api.semanticscholar.org, archive.org, archive.org, archive.org, web.archive.org, www.history.army.mil, doi.org, www.jstor.org, api.semanticscholar.org, doi.org, www.jstor.org, archive.org, en.wiktionary.org, commons.wikimedia.org, en.wikinews.org, en.wikiquote.org, en.wikisource.org, en.wikibooks.org, en.wikiversity.org, en.wikivoyage.org, westpoint.edu, web.archive.org, westpoint.edu, web.archive.org, en.wikisource.org, omniatlas.com, www.wikidata.org, catalogo.bne.es, catalogue.bnf.fr, data.bnf.fr, d-nb.info, uli.nli.org.il, id.loc.gov, id.ndl.go.jp, aleph.nkp.cz, lod.nl.go.kr, libris.kb.se, kulturnav.org, esu.com.ua, hls-dhs-dss.ch, www.encyclopediaofukraine.com, www.e-lir.ch, catalog.archives.gov, islamansiklopedisi.org.tr, foundation.wikimedia.org, foundation.wikimedia.org, www.wikimediafoundation.org, foundation.wikimedia.org, foundation.wikimedia.org, developer.wikimedia.org, stats.wikimedia.org, foundation.wikimedia.org, en.m.wikipedia.org, wikimediafoundation.org, www.mediawiki.org
en.wikipedia.org, premium.britannica.com, kids.britannica.com, academic.eb.com, cdn.britannica.com, cdn.britannica.com, cdn.britannica.com, cdn.britannica.com, cdn.britannica.com, cdn.britannica.com, cdn.britannica.com, www.facebook.com, twitter.com, ethw.org, www.nationalww2museum.org, weaponsandwarfare.com, www.ncbi.nlm.nih.gov, nzhistory.govt.nz, www.historylearningsite.co.uk, www.historyworld.net, kids.britannica.com, kids.britannica.com, www.facebook.com, twitter.com, ethw.org, www.nationalww2museum.org, weaponsandwarfare.com, www.ncbi.nlm.nih.gov, nzhistory.govt.nz, www.historylearningsite.co.uk, www.historyworld.net, kids.britannica.com, kids.britannica.com, cdn.britannica.com, www.thehindu.com, www.yahoo.com, www.merriam-webster.com, www.merriam-webster.com, cdn.britannica.com, cdn.britannica.com, cdn.britannica.com, cdn.britannica.com, www.merriam-webster.com, www.merriam-webster.com
www.britannica.com, play.history.com, play.history.com, www.facebook.com, twitter.com, www.youtube.com, instagram.com, www.tiktok.com, play.history.com, play.history.com, www.historyvault.com, www.historystore.com, www.aenetworks.com, www.historyvault.com, www.historystore.com, www.historymakerscommunity.com, www.facebook.com, twitter.com, www.youtube.com, www.instagram.com, www.tiktok.com, www.aetv.com, www.mylifetime.com, www.mylifetime.com, www.fyi.tv, viceland.com, www.biography.com, www.crimeandinvestigationnetwork.com, www.historyenespanol.com, www.mylifetime.com, military.history.com, www.aenetworks.com, www.aenetworks.com, www.aenetworks.com, www.aenetworks.com, www.aenetworks.com, www.aenetworks.com, history.zendesk.com, www.aenetworks.com, www.aenetworks.com, www.aenetworks.com, www.aenetworks.com, www.aenetworks.com, www.aenetworks.com, www.aenetworks.com, www.aenetworks.com, www.aenetworks.com, www.aenetworks.com
www.history.com, play.history.com, play.history.com, www.facebook.com, twitter.com, www.youtube.com, instagram.com, www.tiktok.com, play.history.com, play.history.com, www.historyvault.com, www.historystore.com, www.aenetworks.com, www.aenetworks.com, support.history.com, www.aenetworks.com, www.historyvault.com, www.historystore.com, www.historymakerscommunity.com, www.facebook.com, twitter.com, www.youtube.com, www.instagram.com, www.tiktok.com, www.aetv.com, www.mylifetime.com, www.mylifetime.com, www.fyi.tv, viceland.com, www.biography.com, www.crimeandinvestigationnetwork.com, www.historyenespanol.com, www.mylifetime.com, military.history.com, www.aenetworks.com, www.aenetworks.com, www.aenetworks.com, www.aenetworks.com, www.aenetworks.com, www.aenetworks.com, history.zendesk.com, www.aenetworks.com, www.aenetworks.com, www.aenetworks.com, www.aenetworks.com, www.aenetworks.com, www.aenetworks.com, www.aenetworks.com, www.aenetworks.com, www.aenetworks.com, www.aenetworks.com
www.history.com, ask.loc.gov, catalog.loc.gov, copyright.gov, www.congress.gov, lcweb2.loc.gov, lcweb2.loc.gov, www.facebook.com, www.twitter.com, www.youtube.com, www.pinterest.com, www.flickr.com, instagram.com, itunes.apple.com, www.research.net, newsroom.loc.gov, library-of-congress-shop.myshopify.com, www.congress.gov, copyright.gov
www.loc.gov, shop.nam.ac.uk, collection.nam.ac.uk, collection.nam.ac.uk, collection.nam.ac.uk, collection.nam.ac.uk, collection.nam.ac.uk, collection.nam.ac.uk, collection.nam.ac.uk, collection.nam.ac.uk, collection.nam.ac.uk, collection.nam.ac.uk, www.facebook.com, twitter.com, www.instagram.com, www.youtube.com
www.nam.ac.uk, store.nationalww2museum.org, www.facebook.com, twitter.com, www.instagram.com, www.youtube.com, www.higginshotelnola.com, www.higginshotelnola.com, impact.nationalww2museum.org, www.facebook.com, twitter.com, secure3.convio.net, ticketing.nationalww2museum.org, store.nationalww2museum.org, www.facebook.com, twitter.com, www.instagram.com, www.youtube.com
www.nationalww2museum.org, twitter.com, www.facebook.com, www.instagram.com, www.linkedin.com, www.youtube.com, www.army.mil, www.marines.mil, www.navy.mil, www.af.mil, www.spaceforce.mil, www.uscg.mil, www.nationalguard.mil, www.army.mil, www.marines.mil, www.navy.mil, www.af.mil, www.spaceforce.mil, www.uscg.mil, www.nationalguard.mil, dodcio.defense.gov, dodcio.defense.gov, www.esd.whs.mil, www.dodig.mil, policy.defense.gov, prhome.defense.gov, www.dimoc.mil, www.esd.whs.mil, open.defense.gov, dam.defense.gov, www.usa.gov, business.defense.gov, twitter.com, www.facebook.com, www.instagram.com, www.linkedin.com, www.youtube.com, media.defense.gov, media.defense.gov, media.defense.gov, media.defense.gov, media.defense.gov, media.defense.gov, media.defense.gov, media.defense.gov, media.defense.gov, media.defense.gov, media.defense.gov, media.defense.gov, media.defense.gov, media.defense.gov, media.defense.gov, media.defense.gov, media.defense.gov, media.defense.gov, media.defense.gov, media.defense.gov, media.defense.gov, media.defense.gov, media.defense.gov, media.defense.gov, public.govdelivery.com, comptroller.defense.gov, dodcio.defense.gov, dodcio.defense.gov, www.esd.whs.mil, www.dodig.mil, policy.defense.gov, prhome.defense.gov, www.dimoc.mil, www.esd.whs.mil, open.defense.gov, dam.defense.gov, www.usa.gov, business.defense.gov, twitter.com, www.facebook.com, www.instagram.com, www.linkedin.com, www.youtube.com, public.govdelivery.com, www.web.dma.mil
www.defense.gov, twitter.com, www.facebook.com, www.instagram.com, www.youtube.com, www.tiktok.com, ad.doubleclick.net, www.raymondjames.com, help.pbs.org, www.shoppbs.org, www.facebook.com, twitter.com, shop.pbs.org, help.pbs.org, www.shoppbs.org, itunes.apple.com, www.amazon.com, mass.pbslearningmedia.org, www.sgptv.org, www.shoppbs.org, twitter.com, www.facebook.com, www.instagram.com, www.youtube.com, www.tiktok.com, ad.doubleclick.net, www.raymondjames.com
www.pbs.org, store.nationalww2museum.org, www.facebook.com, twitter.com, www.instagram.com, www.youtube.com, www.higginshotelnola.com, www.higginshotelnola.com, impact.nationalww2museum.org, www.facebook.com, twitter.com, secure3.convio.net, ticketing.nationalww2museum.org, store.nationalww2museum.org, www.facebook.com, twitter.com, www.instagram.com, www.youtube.com
www.nationalww2museum.org, www.ushmm.org, www.ushmm.org, twitter.com, www.facebook.com, docs.google.com, www.ushmm.org, plus.google.com, www.ushmm.org, www.ushmm.org, www.ushmm.org, www.ushmm.org, donate.ushmm.org, www.ushmm.org, www.ushmm.org, www.ushmm.org, www.ushmm.org, www.ushmm.org, www.ushmm.org, www.ushmm.org, www.ushmm.org, collections.ushmm.org, www.ushmm.org, newspapers.ushmm.org, perspectives.ushmm.org, earlywarningproject.ushmm.org, www.ushmm.org, www.ushmm.org, www.ushmm.org, www.ushmm.org, www.ushmm.org, www.ushmm.org
encyclopedia.ushmm.org, fdr.blogs.archives.gov, estore.archives.gov, www.fdrlibrary.marist.edu, support.rooseveltinstitute.org, rooseveltinstitute.org, rooseveltinstitute.org, www.archives.gov, www.facebook.com, twitter.com, www.youtube.com, www.flickr.com
www.fdrlibrary.org
www.digitalhistory.uh.edu, us.cnn.com, edition.cnn.com, arabic.cnn.com, cnnespanol.cnn.com, us.cnn.com, edition.cnn.com, arabic.cnn.com, cnnespanol.cnn.com, facebook.com, twitter.com, instagram.com, money.cnn.com, money.cnn.com, bleacherreport.com, bleacherreport.com, bleacherreport.com, bleacherreport.com, bleacherreport.com, bleacherreport.com, www.max.com, store.cnn.com, coupons.cnn.com, careers.wbd.com, www.nationalww2museum.org, www.bbc.com, dcas.dmdc.osd.mil, encyclopedia.ushmm.org, www.ourdocuments.gov, www.archives.gov, money.cnn.com, money.cnn.com, bleacherreport.com, bleacherreport.com, bleacherreport.com, bleacherreport.com, bleacherreport.com, bleacherreport.com, www.max.com, store.cnn.com, coupons.cnn.com, careers.wbd.com, facebook.com, twitter.com, instagram.com, warnermediaprivacy.com
www.cnn.com, developers.google.com, tv.youtube.com
www.youtube.com, www.youtube.com, nextdoor.com, www.linkedin.com, ipn2.paymentus.com, www.governmentjobs.com, highpointnc.sharepoint.com, outlook.office365.com, connect.civicplus.com
www.highpointnc.gov, www.addtoany.com, historyhub.history.gov, www.youtube.com, abmc.gov, aad.archives.gov, aad.archives.gov, historyhub.history.gov, historyhub.history.gov, historyhub.history.gov, historyhub.history.gov, historyhub.history.gov, historyhub.history.gov, historyhub.history.gov, www.youtube.com, historyhub.history.gov, historyhub.history.gov, aad.archives.gov, www.usa.gov
www.archives.gov, www.state.gov, www.state.gov, www.state.gov, www.state.gov, www.state.gov
history.state.gov, www.cvent.com
www.imf.org, www.facebook.com, twitter.com, www.instagram.com, www.youtube.com
www.75thwwiicommemoration.org, account.natgeokids.com, account.natgeokids.com, shop.natgeokids.co.uk, account.natgeokids.com, www.nam.ac.uk, www.iwm.org.uk, www.facebook.com, twitter.com, reddit.com, www.linkedin.com, mewe.com, mix.com, api.whatsapp.com, cookiedatabase.org
www.natgeokids.com, www.paypal.com, www.paypal.com, www.paypal.com
wwiifoundation.org, www.facebook.com, twitter.com, www.instagram.com, www.youtube.com, www.59mdw.af.mil, jbsatoday.com, media.defense.gov, media.defense.gov, legalassistance.law.af.mil, www.resilience.af.mil, www.af.mil, www.af.mil, www.compliance.af.mil, www.af.mil, www.veteranscrisisline.net, www.afinspectorgeneral.af.mil, www.osi.af.mil, www.facebook.com, www.instagram.com, twitter.com, www.youtube.com, www.web.dma.mil, www.veteranscrisisline.net
www.jbsa.mil, apps.apple.com, play.google.com, www.doi.gov, www.doi.gov, www.usa.gov, www.facebook.com, www.youtube.com, www.twitter.com, www.instagram.com, www.flickr.com
www.nps.gov, collections.mnhs.org, www.mnopedia.org, www.mnopedia.org, libguides.mnhs.org, www.worldcat.org, www.worldcat.org, libguides.mnhs.org, libguides.mnhs.org, ddr.densho.org, collections.mnhs.org, collections.mnhs.org, mnhs.gitlab.io, www.facebook.com, www.twitter.com, www.linkedin.com, www.instagram.com, www.youtube.com
www.mnhs.org, service.elsevier.com, service.elsevier.com, www.elsevier.com, www.elsevier.com, sd-cart.elsevier.com, service.elsevier.com, www.elsevier.com, www.elsevier.com, www.relx.com
www.sciencedirect.com, www.youtube.com, www.aam-us.org, mansfieldhistoricalsociety1.weebly.com, www.tarrantcounty.com, www.tarrantcounty.com, texasmuseums.org, www.civicplus.com
www.mansfieldtexas.gov
www.amazon.com, www.afmuseum.com, www.afmuseum.com, store.airforcemuseum.com, www.afmuseum.com, www.facebook.com, www.twitter.com, www.instagram.com, youtube.com, media.defense.gov, media.defense.gov, media.defense.gov, media.defense.gov, media.defense.gov, media.defense.gov, media.defense.gov, media.defense.gov, media.defense.gov, media.defense.gov, media.defense.gov, media.defense.gov, media.defense.gov, media.defense.gov, media.defense.gov, media.defense.gov, media.defense.gov, media.defense.gov, media.defense.gov, media.defense.gov, media.defense.gov, media.defense.gov, www.defense.gov, dpcld.defense.gov, open.defense.gov , dod.defense.gov, www.esd.whs.mil, www.af.mil, www.af.mil, dodcio.defense.gov, www.af.mil, www.veteranscrisisline.net, www.airforcesmallbiz.af.mil, www.resilience.af.mil, www.af.mil, www.usa.gov, prhome.defense.gov, www.foia.af.mil, www.osi.af.mil, www.af.mil, legalassistance.law.af.mil, www.af.mil, www.airforce.com, www.airforce.com, www.airforce.com, www.goang.com, www.afreserve.com, www.usajobs.gov, www.facebook.com, www.twitter.com, www.instagram.com, youtube.com, www.web.dma.mil
www.nationalmuseum.af.mil
history.army.mil, ssl.bbc.co.uk, ssl.bbc.co.uk, ssl.bbc.co.uk, m.bbc.co.uk
www.bbc.co.uk, usnhistory.navylive.dodlive.mil, usnhistory.navylive.dodlive.mil, N94032.eos-intl.net, www.usnwc.edu, www.usna.edu, www.facebook.com, twitter.com, www.youtube.com, www.flickr.com, usnhistory.navylive.dodlive.mil, www.instagram.com, veteranscrisisline.net, www.safehelpline.org, dodcio.defense.gov, hq.ahf.nmci.navy.mil, www.navy.mil, www.navy.com, www.usa.gov, www.usajobs.gov, prhome.defense.gov
www.history.navy.mil, www.cbssports.com, www.cbsstore.com, www.paramountplus.com, pages.beamery.com, www.viacomcbsprivacy.com, privacy.paramount.com, www.cbsinteractive.com, www.cbscorporation.com, www.cbsinteractive.com, www.cbs.com, www.paramountplus.com, www.cbsstore.com, help.cbsnews.com, www.facebook.com, twitter.com, instagram.com, www.youtube.com
www.cbsnews.com, www.dictionary.com:80, www.thesaurus.com:80, play.dictionary.com, www.thesaurus.com, www.dictionary.com:80, www.dictionary.com:80, play.dictionary.com, www.thesaurus.com, www.grammarcoach.com, www.thesaurus.com, www.thesaurus.com, www.thesaurus.com, www.dictionary.com:80, www.thedailybeast.com, www.thedailybeast.com, www.thedailybeast.com, www.thedailybeast.com, www.thedailybeast.com, www.thedailybeast.com, www.thedailybeast.com, www.thedailybeast.com, www.thedailybeast.com, www.thedailybeast.com, www.gutenberg.org, www.gutenberg.org, www.gutenberg.org, www.gutenberg.org, www.dictionary.com:80, www.dictionary.com:80, www.dictionary.com:80, www.dictionary.com:80, www.dictionary.com:80, www.dictionary.com:80, www.dictionary.com:80, www.dictionary.com:80, www.dictionary.com:80, www.dictionary.com:80, www.dictionary.com:80, www.dictionary.com:80, www.dictionary.com:80, www.dictionary.com:80, www.dictionary.com:80, www.dictionary.com:80, www.dictionary.com:80, www.dictionary.com:80, www.dictionary.com:80, www.dictionary.com:80, www.dictionary.com:80, www.dictionary.com:80, www.dictionary.com:80, www.dictionary.com:80, www.dictionary.com:80, www.dictionary.com:80, www.dictionary.com:80, www.dictionary.com:80, www.thesaurus.com:80, www.grammarcoach.com, www.myrocketcareer.com, store.dictionary.com, www.dictionary.com:80
www.dictionary.com, help.nytimes.com, www.nytco.com, help.nytimes.com, help.nytimes.com, www.nytco.com, nytmediakit.com, www.tbrandstudio.com, help.nytimes.com, help.nytimes.com, help.nytimes.com
www.nytimes.com, www.youtube.com, youtu.be, www.youtube.com, youtu.be, s.si.edu, docs.google.com, www.facebook.com, twitter.com, www.instagram.com, www.youtube.com, www.flickr.com, maps.google.com, maps.google.com, www.etix.com, goo.gl, goo.gl, www.si.edu, www.si.edu, www.si.edu
airandspace.si.edu, subscribe.smithsonianmag.com, ssl.drgnetwork.com, www.smithsonianstore.com, subscribe.smithsonianmag.com, subscribe.smithsonianmag.com, ssl.drgnetwork.com, www.smithsonianjourneys.org, www.si.edu, photocontest.smithsonianmag.com, photocontest.smithsonianmag.com, www.instagram.com, www.smithsonianstore.com, eos.org, theconversation.com, photocontest.smithsonianmag.com, subscribe.smithsonianmag.com, subscribe.smithsonianmag.com, ssl.drgnetwork.com, ssl.drgnetwork.com, www.si.edu, www.smithsonian.com, www.smithsonianstore.com, www.smithsonianjourneys.org, www.smithsonianchannel.com, www.smithsonianbooks.com, www.si.edu, www.si.edu, www.si.edu
www.smithsonianmag.com
