www.americanyawp.com, tsha.wildapricot.org, am.tsha.events, join.tshaonline.org, join.tshaonline.org, donate.tshaonline.org, www.legacyoftexas.com, www.legacyoftexas.com, www.legacyoftexas.com, www.legacyoftexas.com, www.legacyoftexas.com, www.legacyoftexas.com, www.legacyoftexas.com, www.legacyoftexas.com, www.legacyoftexas.com, www.legacyoftexas.com, www.legacyoftexas.com, am.tsha.events, www.sanjacintosymposium.com, www.mytsha.com, tsha.wildapricot.org, tsha.wildapricot.org, tsha.wildapricot.org, juniorhistorians.club, webbsociety.club, texashistoryday.com, join.tshaonline.org, join.tshaonline.org, join.tshaonline.org, facebook.com, twitter.com, reddit.com, pinterest.com, tsha.wildapricot.org, Smith V. Allright, donate.tshaonline.org, donate.tshaonline.org, www.legacyoftexas.com, www.legacyoftexas.com, www.legacyoftexas.com, www.legacyoftexas.com, www.legacyoftexas.com, www.legacyoftexas.com, www.legacyoftexas.com, www.legacyoftexas.com, www.legacyoftexas.com, www.legacyoftexas.com, www.texasalmanac.com, join.tshaonline.org, join.tshaonline.org, donate.tshaonline.org, donate.tshaonline.org, www.legacyoftexas.com, www.legacyoftexas.com
www.tshaonline.org, www.AmericanYawp.com, www.loc.gov, commons.wikimedia.org, www.loc.gov, commons.wikimedia.org, commons.wikimedia.org, upload.wikimedia.org, commons.wikimedia.org, commons.wikimedia.org, commons.wikimedia.org, wordpress.org, creativecommons.org, www.sup.org
www.americanyawp.com, tsha.wildapricot.org, am.tsha.events, join.tshaonline.org, join.tshaonline.org, donate.tshaonline.org, www.legacyoftexas.com, www.legacyoftexas.com, www.legacyoftexas.com, www.legacyoftexas.com, www.legacyoftexas.com, www.legacyoftexas.com, www.legacyoftexas.com, www.legacyoftexas.com, www.legacyoftexas.com, www.legacyoftexas.com, www.legacyoftexas.com, am.tsha.events, www.sanjacintosymposium.com, www.mytsha.com, tsha.wildapricot.org, tsha.wildapricot.org, tsha.wildapricot.org, juniorhistorians.club, webbsociety.club, texashistoryday.com, join.tshaonline.org, join.tshaonline.org, join.tshaonline.org, facebook.com, twitter.com, reddit.com, pinterest.com, tsha.wildapricot.org, Smith V. Allright, donate.tshaonline.org, donate.tshaonline.org, www.legacyoftexas.com, www.legacyoftexas.com, www.legacyoftexas.com, www.legacyoftexas.com, www.legacyoftexas.com, www.legacyoftexas.com, www.legacyoftexas.com, www.legacyoftexas.com, www.legacyoftexas.com, www.legacyoftexas.com, www.texasalmanac.com, join.tshaonline.org, join.tshaonline.org, donate.tshaonline.org, donate.tshaonline.org, www.legacyoftexas.com, www.legacyoftexas.com
www.tshaonline.org, sites.google.com, www.p12.nysed.gov, sites.google.com, vpn.wnyric.org, onbocespromethean.weebly.com, www.fastsupport.com, wnyricprod.service-now.com, orleansniagaradistrictny.sites.thrillshare.com, wincapweb.com, app.frontlineeducation.com, outlook.com, eschooldata.wnyric.org, miltonf1.wnyric.org, login.frontlineeducation.com, sites.google.com, www.myschoolbuilding.com, reichert.bgsu.wikispaces.net, reichert.bgsu.wikispaces.net, reichert.bgsu.wikispaces.net, reichert.bgsu.wikispaces.net, reichert.bgsu.wikispaces.net, reichert.bgsu.wikispaces.net, reichert.bgsu.wikispaces.net, reichert.bgsu.wikispaces.net, reichert.bgsu.wikispaces.net, reichert.bgsu.wikispaces.net, reichert.bgsu.wikispaces.net, reichert.bgsu.wikispaces.net, reichert.bgsu.wikispaces.net, reichert.bgsu.wikispaces.net, reichert.bgsu.wikispaces.net, reichert.bgsu.wikispaces.net, reichert.bgsu.wikispaces.net, reichert.bgsu.wikispaces.net, reichert.bgsu.wikispaces.net, reichert.bgsu.wikispaces.net, reichert.bgsu.wikispaces.net, reichert.bgsu.wikispaces.net, reichert.bgsu.wikispaces.net, reichert.bgsu.wikispaces.net, reichert.bgsu.wikispaces.net, reichert.bgsu.wikispaces.net, reichert.bgsu.wikispaces.net, reichert.bgsu.wikispaces.net, reichert.bgsu.wikispaces.net, reichert.bgsu.wikispaces.net, reichert.bgsu.wikispaces.net, reichert.bgsu.wikispaces.net, reichert.bgsu.wikispaces.net, reichert.bgsu.wikispaces.net, reichert.bgsu.wikispaces.net, reichert.bgsu.wikispaces.net, reichert.bgsu.wikispaces.net, reichert.bgsu.wikispaces.net, reichert.bgsu.wikispaces.net, reichert.bgsu.wikispaces.net, reichert.bgsu.wikispaces.net, reichert.bgsu.wikispaces.net, reichert.bgsu.wikispaces.net, reichert.bgsu.wikispaces.net, reichert.bgsu.wikispaces.net, reichert.bgsu.wikispaces.net, reichert.bgsu.wikispaces.net, reichert.bgsu.wikispaces.net, www.facebook.com, twitter.com, www.youtube.com, www.schoolwires.com, www.finalsite.com, www.finalsite.com
www.onboces.org, twitter.com, www.facebook.com, www.instagram.com, travel.state.gov, www.state.gov, twitter.com, www.facebook.com, www.youtube.com, www.flickr.com, www.instagram.com
it.usembassy.gov
www.mckinsey.com, www.facebook.com, twitter.com, www.instagram.com, store.okhistory.org, public.govdelivery.com, public.govdelivery.com, oklahoma.gov
www.okhistory.org, en-gb.facebook.com, audioboom.com, www.linkedin.com, twitter.com, www.youtube.com, en-gb.facebook.com, audioboom.com, www.linkedin.com, twitter.com, www.youtube.com, twitter.com, www.facebook.com, www.linkedin.com, voxeu.org, twitter.com, www.facebook.com, www.linkedin.com, en-gb.facebook.com, audioboom.com, www.linkedin.com, twitter.com, www.youtube.com, www.designbysoapbox.com
cepr.org, donate.wikimedia.org, kbd.wikipedia.su, af.wikipedia.su, als.wikipedia.su, am.wikipedia.su, smn.wikipedia.su, ang.wikipedia.su, ar.wikipedia.su, an.wikipedia.su, hyw.wikipedia.su, frp.wikipedia.su, as.wikipedia.su, ast.wikipedia.su, gn.wikipedia.su, av.wikipedia.su, az.wikipedia.su, azb.wikipedia.su, ban.wikipedia.su, bn.wikipedia.su, zh-min-nan.wikipedia.su, map-bms.wikipedia.su, ba.wikipedia.su, be.wikipedia.su, be-tarask.wikipedia.su, bh.wikipedia.su, bcl.wikipedia.su, bi.wikipedia.su, bg.wikipedia.su, bar.wikipedia.su, bo.wikipedia.su, bs.wikipedia.su, br.wikipedia.su, bxr.wikipedia.su, ca.wikipedia.su, cv.wikipedia.su, ceb.wikipedia.su, cs.wikipedia.su, cbk-zam.wikipedia.su, ny.wikipedia.su, sn.wikipedia.su, co.wikipedia.su, cy.wikipedia.su, da.wikipedia.su, ary.wikipedia.su, se.wikipedia.su, pdc.wikipedia.su, de.wikipedia.su, nv.wikipedia.su, dsb.wikipedia.su, dty.wikipedia.su, et.wikipedia.su, el.wikipedia.su, eml.wikipedia.su, es.wikipedia.su, eo.wikipedia.su, ext.wikipedia.su, eu.wikipedia.su, fa.wikipedia.su, hif.wikipedia.su, fo.wikipedia.su, fr.wikipedia.su, fy.wikipedia.su, fur.wikipedia.su, ga.wikipedia.su, gv.wikipedia.su, gd.wikipedia.su, gl.wikipedia.su, gan.wikipedia.su, gu.wikipedia.su, hak.wikipedia.su, ko.wikipedia.su, ha.wikipedia.su, hy.wikipedia.su, hi.wikipedia.su, hsb.wikipedia.su, hr.wikipedia.su, io.wikipedia.su, ig.wikipedia.su, ilo.wikipedia.su, id.wikipedia.su, ia.wikipedia.su, os.wikipedia.su, is.wikipedia.su, it.wikipedia.su, he.wikipedia.su, jv.wikipedia.su, kbp.wikipedia.su, kn.wikipedia.su, krc.wikipedia.su, ka.wikipedia.su, ks.wikipedia.su, kk.wikipedia.su, kw.wikipedia.su, sw.wikipedia.su, ht.wikipedia.su, gcr.wikipedia.su, ku.wikipedia.su, ky.wikipedia.su, lld.wikipedia.su, lad.wikipedia.su, lo.wikipedia.su, la.wikipedia.su, lv.wikipedia.su, lb.wikipedia.su, lez.wikipedia.su, lt.wikipedia.su, lij.wikipedia.su, li.wikipedia.su, lfn.wikipedia.su, olo.wikipedia.su, jbo.wikipedia.su, lmo.wikipedia.su, hu.wikipedia.su, mai.wikipedia.su, mk.wikipedia.su, mg.wikipedia.su, ml.wikipedia.su, mt.wikipedia.su, mi.wikipedia.su, mr.wikipedia.su, xmf.wikipedia.su, arz.wikipedia.su, mzn.wikipedia.su, ms.wikipedia.su, min.wikipedia.su, cdo.wikipedia.su, mwl.wikipedia.su, mn.wikipedia.su, my.wikipedia.su, nah.wikipedia.su, nl.wikipedia.su, nds-nl.wikipedia.su, ne.wikipedia.su, new.wikipedia.su, ja.wikipedia.su, nap.wikipedia.su, nqo.wikipedia.su, ce.wikipedia.su, frr.wikipedia.su, pih.wikipedia.su, no.wikipedia.su, nn.wikipedia.su, oc.wikipedia.su, mhr.wikipedia.su, or.wikipedia.su, uz.wikipedia.su, pa.wikipedia.su, pfl.wikipedia.su, pnb.wikipedia.su, blk.wikipedia.su, pap.wikipedia.su, ps.wikipedia.su, jam.wikipedia.su, km.wikipedia.su, pcd.wikipedia.su, pms.wikipedia.su, nds.wikipedia.su, pl.wikipedia.su, pt.wikipedia.su, kaa.wikipedia.su, crh.wikipedia.su, ksh.wikipedia.su, ro.wikipedia.su, rm.wikipedia.su, qu.wikipedia.su, rue.wikipedia.su, ru.wikipedia.su, sah.wikipedia.su, szy.wikipedia.su, sa.wikipedia.su, sat.wikipedia.su, sc.wikipedia.su, sco.wikipedia.su, stq.wikipedia.su, sq.wikipedia.su, scn.wikipedia.su, si.wikipedia.su, simple.wikipedia.su, sd.wikipedia.su, sk.wikipedia.su, sl.wikipedia.su, cu.wikipedia.su, szl.wikipedia.su, so.wikipedia.su, ckb.wikipedia.su, sr.wikipedia.su, sh.wikipedia.su, su.wikipedia.su, fi.wikipedia.su, sv.wikipedia.su, tl.wikipedia.su, ta.wikipedia.su, kab.wikipedia.su, roa-tara.wikipedia.su, tt.wikipedia.su, te.wikipedia.su, th.wikipedia.su, din.wikipedia.su, tg.wikipedia.su, tr.wikipedia.su, tk.wikipedia.su, kcg.wikipedia.su, tyv.wikipedia.su, uk.wikipedia.su, ur.wikipedia.su, ug.wikipedia.su, za.wikipedia.su, vec.wikipedia.su, vep.wikipedia.su, vi.wikipedia.su, vo.wikipedia.su, fiu-vro.wikipedia.su, wa.wikipedia.su, zh-classical.wikipedia.su, vls.wikipedia.su, war.wikipedia.su, wo.wikipedia.su, wuu.wikipedia.su, yi.wikipedia.su, yo.wikipedia.su, zh-yue.wikipedia.su, diq.wikipedia.su, zea.wikipedia.su, bat-smg.wikipedia.su, zh.wikipedia.su, tly.wikipedia.su, www.wikidata.org, www.wikidata.org, commons.wikimedia.org, en.wikinews.org, en.wikiquote.org, en.wikiversity.org, en.wikivoyage.org, phabricator.wikimedia.org, www.mediawiki.org, archive.org, go.gale.com, doi.org, web.archive.org, archive.org, www.npr.org, web.archive.org, www.jstor.org, doi.org, www.jstor.org, web.archive.org, usa.usembassy.de, web.archive.org, asiatimes.com, web.archive.org, www.nytimes.com, web.archive.org, www.irishtimes.com, web.archive.org, books.google.com, books.google.com, books.google.com, thediplomat.com, web.archive.org, www.militaryhistoryonline.com, web.archive.org, doi.org, www.jstor.org, api.semanticscholar.org, www.ibiblio.org, web.archive.org, ww2db.com, web.archive.org, www.ibiblio.org, web.archive.org, books.google.com, www.history.co.uk, web.archive.org, doi.org, www.jstor.org, api.semanticscholar.org, www.warhistoryonline.com, web.archive.org, books.google.com, books.google.com, www.ibiblio.org, www.ibiblio.org, web.archive.org, www.ibiblio.org, web.archive.org, www.history.army.mil, doi.org, api.semanticscholar.org, www.ibiblio.org, www.ibiblio.org, www.ibiblio.org, web.archive.org, archive.org, archive.org, www.ibiblio.org, web.archive.org, www.ibiblio.org, web.archive.org, www.ibiblio.org, web.archive.org, www.ibiblio.org, web.archive.org, www.asahi.com, web.archive.org, www.ibiblio.org, web.archive.org, en.wikisource.org, www.ibiblio.org, www.ibiblio.org, web.archive.org, www.ibiblio.org, web.archive.org, www.ibiblio.org, web.archive.org, www.ibiblio.org, web.archive.org, www.ibiblio.org, web.archive.org, books.google.com, archive.org, archive.org, web.archive.org, www.ibiblio.org, web.archive.org, www.mzv.sk, web.archive.org, countrystudies.us, web.archive.org, web.archive.org, www.china1931.cn, www.wired.com, web.archive.org, web.archive.org, www.navy.mil, doi.org, api.semanticscholar.org, www.geographiapolonica.pl, doi.org, web.archive.org, web.archive.org, www.igipz.pan.pl, rcin.org.pl, web.archive.org, www.geographiapolonica.pl, doi.org, web.archive.org, www.britannica.com, www.un.org, web.archive.org, web.archive.org, www.un.org, www.un.org, web.archive.org, web.archive.org, www.unfoundation.org, www.britannica.com, 2001-2009.state.gov, web.archive.org, books.google.com, archive.org, archive.org, web.archive.org, web.jjay.cuny.edu, necrometrics.com, web.archive.org, secondworldwar.co.uk, web.archive.org, books.google.com, fcit.usf.edu, arquivo.pt, www.nybooks.com, web.archive.org, www.ushmm.org, web.archive.org, www.bbc.co.uk, web.archive.org, books.google.com, hrcak.srce.hr, web.archive.org, volhyniamassacre.eu, web.archive.org, dzieje.pl, web.archive.org, www.hawaii.edu, web.archive.org, www.historynet.com, web.archive.org, archive.today, search.japantimes.co.jp, books.google.com, www.gegenwind.info, www.historians.org, web.archive.org, books.google.com, web.archive.org, www.dw-world.de, www.dw.com, scepsis.ru, web.archive.org, web.archive.org, www.pbs.org, web.archive.org, www.fas.harvard.edu, lcweb2.loc.gov, web.archive.org, books.google.com, doi.org, www.iwm.org.uk, web.archive.org, doi.org, doi.org, www.worldcat.org, api.semanticscholar.org, www.amnesty.org, web.archive.org, web.archive.org, history.sandiego.edu, go.gale.com, www.au.af.mil, web.archive.org, www.insightsonindia.com, web.archive.org, web.archive.org, www.acs.org, archive.org, doi.org, www.jstor.org, doi.org, www.jstor.org, archive.org, archive.org, archive.org, web.archive.org, universitypublishingonline.org, archive.org, doi.org, hdiplo.org, doi.org, ui.adsabs.harvard.edu, doi.org, doi.org, www.jstor.org, archive.org, archive.org, doi.org, www.jstor.org, api.semanticscholar.org, archive.org, archive.org, www.questia.com, web.archive.org, archive.org, www.worldcat.org, archive.org, doi.org, www.jstor.org, web.archive.org, doi.org, www.jstor.org, api.semanticscholar.org, artukraine.com, web.archive.org, sovietinfo.tripod.com, doi.org, www.jstor.org, pubmed.ncbi.nlm.nih.gov, web.archive.org, ru.wikipedia.su, doi.org, www.jstor.org, archive.org, archive.org, archive.org, web.archive.org, www.worldcat.org, www-cgsc.army.mil, archive.org, web.archive.org, www.strom.clemson.edu, archive.org, web.archive.org, www.worldcat.org, www-cgsc.army.mil, archive.org, archive.org, archive.org, archive.org, doi.org, www.jstor.org, api.semanticscholar.org, archive.org, archive.org, archive.org, doi.org, api.semanticscholar.org, archive.org, www.amazon.com, www.worldcat.org, archive.org, archive.org, archive.org, ru.wikipedia.su, archive.org, archive.org, archive.org, archive.org, archive.org, www.jstor.org, doi.org, www.jstor.org, doi.org, www.jstor.org, api.semanticscholar.org, archive.org, web.archive.org, www.history.army.mil, lccn.loc.gov, www.history.army.mil, archive.org, archive.org, archive.org, archive.org, doi.org, www.jstor.org, archive.org, www.jstor.org, archive.org, www.ibiblio.org, web.archive.org, archive.org, archive.org, archive.org, archive.org, archive.org, archive.org, doi.org, doi.org, archive.org, doi.org, www.jstor.org, api.semanticscholar.org, archive.org, archive.org, archive.org, web.archive.org, www.strategicstudiesinstitute.army.mil, archive.org, archive.org, doi.org, www.jstor.org, archive.org, www.ibiblio.org, web.archive.org, doi.org, www.jstor.org, archive.org, archive.org, doi.org, www.jstor.org, api.semanticscholar.org, www.jstor.org, doi.org, www.jstor.org, archive.org, archive.org, doi.org, www.jstor.org, api.semanticscholar.org, doi.org, www.jstor.org, doi.org, www.jstor.org, api.semanticscholar.org, doi.org, api.semanticscholar.org, archive.org, archive.org, archive.org, web.archive.org, www.history.army.mil, doi.org, www.jstor.org, api.semanticscholar.org, doi.org, www.jstor.org, archive.org, en.wiktionary.org, commons.wikimedia.org, en.wikinews.org, en.wikiquote.org, en.wikisource.org, en.wikibooks.org, en.wikiversity.org, en.wikivoyage.org, westpoint.edu, web.archive.org, westpoint.edu, web.archive.org, en.wikisource.org, omniatlas.com, www.wikidata.org, catalogo.bne.es, catalogue.bnf.fr, data.bnf.fr, d-nb.info, uli.nli.org.il, id.loc.gov, id.ndl.go.jp, aleph.nkp.cz, lod.nl.go.kr, libris.kb.se, kulturnav.org, esu.com.ua, hls-dhs-dss.ch, www.encyclopediaofukraine.com, www.e-lir.ch, catalog.archives.gov, islamansiklopedisi.org.tr, en.wikipedia.org, foundation.wikimedia.org, foundation.wikimedia.org, www.wikimediafoundation.org, foundation.wikimedia.org, foundation.wikimedia.org, developer.wikimedia.org, stats.wikimedia.org, foundation.wikimedia.org, en.m.wikipedia.org, wikimediafoundation.org, www.mediawiki.org
en.wikipedia.su, www.keanfoundation.org, alumni.kean.edu, kean.workvivo.com, libguides.kean.edu, kean.instructure.com, blackboard.kean.edu, bit.ly, bit.ly, bit.ly, kean.campuslabs.com, sso.kean.edu, webreg.kean.edu, www.keanathletics.com, www.keanfoundation.org, alumni.kean.edu, kean.workvivo.com, www.worldwariiscrapbook.com, www.facebook.com, twitter.com, www.youtube.com, www.instagram.com, www.linkedin.com
www.kean.edu, accessibility.asu.edu, my.asu.edu, weblogin.asu.edu, accessibility.asu.edu, my.asu.edu, weblogin.asu.edu, webapp4.asu.edu, www.google.com, www.mozilla.org, webapp4.asu.edu, webapp4.asu.edu, www.facebook.com, www.twitter.com, www.linkedin.com, www.instagram.com, www.youtube.com, starbucks.asu.edu, starbucks.asu.edu, www.asu.edu, www.asu.edu, isearch.asu.edu, www.asu.edu, my.asu.edu, www.asu.edu, www.asu.edu, www.asu.edu, www.asu.edu, www.asu.edu
asuonline.asu.edu, account.forbes.com, account.forbes.com, bertie.forbes.com, account.forbes.com, www.twitter.com, www.parsintl.com
www.forbes.com, checkout.justgiving.com, shop.iwm.org.uk, shop.iwm.org.uk, shop.iwm.org.uk, shop.iwm.org.uk, shop.iwm.org.uk, shop.iwm.org.uk, shop.iwm.org.uk, twitter.com, www.facebook.com
www.iwm.org.uk, www.facebook.com, twitter.com, navymedicine.navylive.dodlive.mil, www.nationalmuseum.af.mil, www.nationalaviation.org, www.npr.org, web.archive.org, time.com, navylive.dodlive.mil, www.defense.gov, www.defense.gov, www.latimes.com, secure.uso.org, action.uso.org, usowishbook.uso.org, www.facebook.com, twitter.com, www.youtube.com, instagram.com, www.linkedin.com, itunes.apple.com, play.google.com
www.uso.org, sites.google.com, docs.google.com, blog.tcea.org, www.history.navy.mil, www.britannica.com, www.iwm.org.uk, oceanexplorer.noaa.gov, static.c-spanvideo.org, www.c-spanshop.org, sites.google.com, c-spanclassroomdeliberations.org, www.studentcam.org, www.facebook.com, twitter.com
www.c-span.org, media.defense.gov, media.defense.gov, deomi.org, media.defense.gov, media.defense.gov, media.defense.gov, www.womensmemorial.org, www.esd.whs.mil, www.defense.gov, www.defense.gov, www.defense.gov, www.usa.gov, dodcio.defense.gov, open.defense.gov, www.web.dma.mil
www.dla.mil, shop.awm.gov.au, ajrp.awm.gov.au, nominal-rolls.dva.gov.au, www.environment.gov.au, placesofpride.awm.gov.au, placesofpride.awm.gov.au, placesofpride.awm.gov.au, maps.google.com, www.facebook.com, twitter.com, www.tripadvisor.com.au, www.instagram.com, www.youtube.com, www.flickr.com
www.awm.gov.au, sightline.dragonforms.com, sightline.dragonforms.com, armytimes.com, marinecorpstimes.com, navytimes.com, www.defensenews.com, www.militarytimes.com, www.militarytimes.com, www.militarytimes.com, www.militarytimes.com, caucus.militarytimes.com, www.militarytimes.com, www.militarytimes.com, valor.militarytimes.com, www.militarytimes.com, caucus.militarytimes.com, www.militarytimes.com, smoy.militarytimes.com, obits.militarytimes.com, payitforward.militarytimes.com, installationguide.militarytimes.com, link.airforcetimes.com, airforcetimes-va.newsmemory.com, installationguide.militarytimes.com, www.kodak.com, 247wallst.com, www.nytimes.com, lemelson.mit.edu, patents.google.com, www.warhistoryonline.com, www.straightdope.com, www.ncbi.nlm.nih.gov, www.facebook.com, twitter.com, sightline.dragonforms.com, boards.greenhouse.io, jobboard.militarytimes.com
www.airforcetimes.com, www.facebook.com, twitter.com, www.youtube.com, player.streamguys.com, lp.constantcontactpages.com, alaskapublic.pbslearningmedia.org, www.pbs.org, pbskids.org, www.alaskaatwork.org, www.bonfire.com, alaskapublic.secureallegiance.com, alaskapublic.wedid.it, player.streamguys.com, lp.constantcontactpages.com, alaskapublic.pbslearningmedia.org, www.pbs.org, pbskids.org, www.alaskaatwork.org, www.bonfire.com, alaskapublic.secureallegiance.com, alaskapublic.wedid.it, www.ktoo.org, www.facebook.com, twitter.com, pinterest.com, api.whatsapp.com, alaskapublic.wedid.it, www.facebook.com, twitter.com, www.youtube.com, www.instagram.com
alaskapublic.org, support.texastribune.org, support.texastribune.org, support.texastribune.org, twitter.com, www.facebook.com, www.reddit.com, www.kxan.com, support.texastribune.org, twitter.com, twitter.com, support.texastribune.org, support.texastribune.org, mediakit.texastribune.org, facebook.com, twitter.com, youtube.com, instagram.com, www.linkedin.com, www.reddit.com, www.facebook.com
www.texastribune.org, pewresearch.networkforgood.com, pewresearch.networkforgood.com, www.usatoday.com, www.humanosphere.org, www.gallup.com, www.census.gov, www.cnbc.com, pewresearch.networkforgood.com, www.instagram.com, twitter.com, www.linkedin.com, www.youtube.com, www.pewtrusts.org
www.pewresearch.org, www.thefreedictionary.com, www.thefreedictionary.com, up.thefreedictionary.com, www.thefreedictionary.com, www.thefreedictionary.com, secure.thefreedictionary.com, secure.thefreedictionary.com, secure.thefreedictionary.com, secure.thefreedictionary.com, secure.thefreedictionary.com, up.thefreedictionary.com, www.thefreedictionary.com, www.freethesaurus.com, legal-dictionary.thefreedictionary.com, acronyms.thefreedictionary.com, encyclopedia.thefreedictionary.com, up.thefreedictionary.com, up.thefreedictionary.com, www.thefreedictionary.com, word-of-the-day.thefreedictionary.com, www.thefreedictionary.com, www.thefreedictionary.com, www.thefreedictionary.com, www.thefreedictionary.com, www.thefreedictionary.com, www.freethesaurus.com, legal-dictionary.thefreedictionary.com, acronyms.thefreedictionary.com, encyclopedia.thefreedictionary.com, www.thefreedictionary.com, www.thefreedictionary.com, secure.thefreedictionary.com, secure.thefreedictionary.com, secure.thefreedictionary.com, secure.thefreedictionary.com, secure.thefreedictionary.com, www.thefreedictionary.com, www.thefreedictionary.com, secure.thefreedictionary.com, www.thefreedictionary.com, www.thefreedictionary.com, www.thefreelibrary.com, www.thefreelibrary.com, www.thefreelibrary.com, www.thefreelibrary.com, www.thefreelibrary.com, www.thefreelibrary.com, www.thefreelibrary.com, www.thefreelibrary.com, www.thefreelibrary.com, www.thefreelibrary.com, www.thefreelibrary.com, www.thefreelibrary.com, www.thefreedictionary.com, www.thefreedictionary.com, www.freethesaurus.com, www.thefreedictionary.com, acronyms.thefreedictionary.com, acronyms.thefreedictionary.com, legal-dictionary.thefreedictionary.com, www.freethesaurus.com, www.thefreedictionary.com, legal-dictionary.thefreedictionary.com, www.freethesaurus.com, www.thefreedictionary.com, acronyms.thefreedictionary.com, acronyms.thefreedictionary.com, www.freethesaurus.com, www.thefreedictionary.com, acronyms.thefreedictionary.com, acronyms.thefreedictionary.com, acronyms.thefreedictionary.com, www.freethesaurus.com, www.thefreedictionary.com, acronyms.thefreedictionary.com, acronyms.thefreedictionary.com, legal-dictionary.thefreedictionary.com, medical-dictionary.thefreedictionary.com, www.freethesaurus.com, www.thefreedictionary.com, acronyms.thefreedictionary.com, acronyms.thefreedictionary.com, acronyms.thefreedictionary.com, www.thefreedictionary.com, www.thefreedictionary.com, www.thefreedictionary.com, www.thefreedictionary.com, legal-dictionary.thefreedictionary.com, www.thefreedictionary.com, www.thefreedictionary.com, www.thefreedictionary.com, www.thefreedictionary.com, www.thefreedictionary.com, www.thefreedictionary.com, acronyms.thefreedictionary.com, www.thefreedictionary.com, legal-dictionary.thefreedictionary.com, www.thefreedictionary.com, www.facebook.com, twitter.com, www.thefreedictionary.com, word-of-the-day.thefreedictionary.com, up.thefreedictionary.com, up.thefreedictionary.com, up.thefreedictionary.com, up.thefreedictionary.com, up.thefreedictionary.com, www.thefreedictionary.com, word-of-the-day.thefreedictionary.com, www.thefreedictionary.com, www.thefreedictionary.com, www.thefreedictionary.com, www.thefreedictionary.com, www.thefreedictionary.com, www.thefreedictionary.com, www.thefreedictionary.com, www.thefreedictionary.com, www.farlex.com
encyclopedia2.thefreedictionary.com, nxslink.fox59.com, www.newsnationnow.com, www.fox59.com, products.bestreviews.com, www.fox59beourguest.com, jobs.fox59.com, jobs.fox59.com, jobs.fox59.com, nxslink.fox59.com, www.facebook.com, twitter.com, www.linkedin.com, bestreviews.com, bestreviews.com, jobs.fox59.com, publicfiles.fcc.gov, www.nexstar.tv, apps.apple.com, play.google.com, apps.apple.com, play.google.com, www.facebook.com, twitter.com, www.instagram.com, www.youtube.com, www.haystack.tv, www.nexstar.tv, www.nexstar.tv, www.nexstar.tv, www.covers.com, www.thehill.com, www.newsnationnow.com, www.bestreviews.com, www.newsnationnow.com, www.nexstardigital.com, www.nexstar.tv
fox59.com, help.npr.org, shopnpr.org, shopnpr.org, media.npr.org, media.npr.org, media.npr.org, media.defense.gov, www.militarytimes.com, media.npr.org, media.npr.org, flyingtigersavg.com, media.npr.org, media.npr.org, www.moody.af.mil, www.af.mil, media.npr.org, time.com, www.youtube.com, www.chinadaily.com.cn, www.af.mil, media.npr.org, www.facebook.com, www.instagram.com, help.npr.org, shopnpr.org, www.nprpresents.org, text.npr.org
www.npr.org, live5results.com, www.palmettolifesc.com, burst.com, www.scemd.org, www.investigatetv.com, www.lowcountryweekend.com, www.511sc.org, www.palmettolifesc.com, gray.tv, live5results.com, www.vuit.com, www.investigatetv.com, www.telemundocharleston.com, www.circleallaccess.com, www.graydc.com, www.facebook.com, www.twitter.com, publicfiles.fcc.gov, publicfiles.fcc.gov, webpubcontent.gray.tv, gray.tv, live5results.com, gray.tv
www.live5news.com
